News Report,Headline,Date
Analysis,Shiba Inu (SHIB) Price Could See Another 20% Decline – Here’s Why,"Mar 19, 2024"
Analysis,Fantom (FTM) Price Analysis: Predicting Consolidation or Bullish Breakout?,"Mar 19, 2024"
News Report,"Wu-Tang Clan, French Montana Drop Music On Bitcoin Ordinals","Mar 19, 2024"
News Report,Japan to Consider Bitcoin Investment After Setting Interest Rates at 0%,"Mar 19, 2024"
News Report,Genesis to Pay $21 Million Penalty Amid SEC Charges,"Mar 19, 2024"
Analysis,BNB Price Forecast: Will the Recent Dip Lead to Further Declines?,"Mar 19, 2024"
Analysis,Here’s How Bitcoin Cash (BCH) Price Could Make a 24% Recovery,"Mar 19, 2024"
Analysis,Polkadot (DOT) Faces Price Consolidation: Is a Downtrend Imminent?,"Mar 19, 2024"
Analysis,How Will Toncoin (TON) React After Telegram Raises $330 Million,"Mar 19, 2024"
News Report,US Judge Sanctions Gary Gensler’s SEC for Abuse in Crypto Case,"Mar 19, 2024"
Analysis,Kaspa (KAS) Price Correction: Is $0.10 at Risk of Being Breached?,"Mar 19, 2024"
Analysis,Here Is Why Near Protocol (NEAR) Price Could Drop By 45% Soon,"Mar 19, 2024"
News Report,"Bitcoin Crashes to $8,900 on This Crypto Exchange","Mar 19, 2024"
News Report,This Meme Coin Is Outperforming the Book of Meme (BOME),"Mar 19, 2024"
Analysis,"Multinational Bank and Mathematical Model Coincide Bitcoin Will Surpass $250,000","Mar 19, 2024"
News Report,This Ethereum ETF Applicant Adds Staking Rewards,"Mar 19, 2024"
