News Report,Headline,Date
News Report,Jim Cramer Flips Back to Bitcoin Bear: ‘I Think It’s Topping Out’,"Jan 9, 2024"
News Report,"Bitcoin Price Dip After ETF Approval Predicted, How Low Could It Go? ","Jan 9, 2024"
News Report,SEC ‘Delay Signal’ Dismissed as Last Minute ETF Amendments Are Made,"Jan 9, 2024"
News Report,Messari Founder’s Tips for Handling Crypto Profits in the Bull Market,"Jan 9, 2024"
Analysis,Solana (SOL) Price Closes Below $100 – Where Will it Find Support?,"Jan 8, 2024"
News Report,North Korean Hackers Execute Largest BTC Transaction in Over a Month: Arkham,"Jan 8, 2024"
News Report,Bitfinex Halts Deposits for UK Users Amid Regulatory Clampdown on Crypto Exchanges,"Jan 8, 2024"
Analysis,Is Dogecoin (DOGE) Set for Recovery With Emerging Bullish Pattern?,"Jan 8, 2024"
News Report,Bitcoin ETF Filings Show Suspiciously Low Fees as Cryptocurrency Price Wars Escalate,"Jan 8, 2024"
News Report,Shiba Inu (SHIB) Reserves on Exchanges Drop 4% as Whales Continue to Accumulate,"Jan 8, 2024"
News Report,How Bitcoin (BTC) ETFs Could Play Into the US Agenda to Ban Crypto,"Jan 8, 2024"
News Report,SEC Warns Against FOMO as Investors Await Spot Bitcoin ETF Approval,"Jan 8, 2024"
News Report,Binance Releases New Proof of Reserves,"Jan 8, 2024"
News Report,Solana Rug Pull Has Begun: Max Keiser,"Jan 8, 2024"
Analysis,This Rare Ethereum (ETH) vs. Bitcoin (BTC) Signal Appears for the Third Time Ever,"Jan 8, 2024"
News Report,Could a Ripple (XRP) ETF Be on the Horizon After Bitcoin?,"Jan 8, 2024"
