News Report,Headline,Date
Feature,The Real Agenda: Why Joe Biden Targets Crypto Now,"Mar 19, 2024"
News Report,"This Is Why Ethereum, Not Bitcoin, Will Power the Future Financial System","Mar 18, 2024"
Analysis,Here is Why the Ripple (XRP) Price Correction Could Continue,"Mar 18, 2024"
News Report,Cardano Welcomes USDM Stablecoin Amid Hydra Layer 2 Hurdles,"Mar 18, 2024"
News Report,Venture Capitalists Pour Millions Into AI Tokens,"Mar 18, 2024"
Analysis,Chainlink (LINK) Price Threatened by This Bearish Signal – Will Holders Step In?,"Mar 18, 2024"
News Report,Cardano Staking ETF Debuts on Swiss Stock Exchange,"Mar 18, 2024"
Analysis,"Will This $2.5 Billion Move Save Bitcoin (BTC) Price From Falling to $60,000?","Mar 18, 2024"
News Report,Tether USDT Faces Restriction in Europe Amid Regulatory Overhaul,"Mar 18, 2024"
Analysis,158 Billion PEPE Tokens Withdrawn from Binance: Price Impact,"Mar 18, 2024"
Analysis,Is Dogecoin (DOGE) Price Headed Back to $0.10?,"Mar 18, 2024"
Analysis,Could Polygon (MATIC) Correction See Price Drop Below $1?,"Mar 18, 2024"
News Report,"How This Meme Coin Project Accidentally Destroyed All Its Tokens, Losing $10 Million","Mar 18, 2024"
Analysis,Litecoin (LTC) Correction: How Deep Will the Price Drop?,"Mar 18, 2024"
Analysis,Here’s Why the Render (RNDR) Price Could Fall by 11% After Hitting an All-Time High,"Mar 18, 2024"
Analysis,Solana Skyrockets Past $200: Unveiling 3 Key Growth Drivers,"Mar 18, 2024"
