News Report,Headline,Date
News Report,Why Japan Wants to Stop Crypto P2P Transactions,"Feb 14, 2024"
Analysis,Cardano (ADA) Breakout: Assessing the Potential for a 45% Gain,"Feb 14, 2024"
News Report,Why $23 Billion in Leveraged Bitcoin (BTC) Positions Won’t Cause a Price Crash,"Feb 14, 2024"
News Report,US Treasury Highlights Growing Concerns of Crypto in Illicit Finance Activities,"Feb 14, 2024"
Analysis,Litecoin (LTC) Eyes February Revival Following Slow Start to the Year,"Feb 14, 2024"
News Report,A Metaverse Comeback? Zuckerberg Touts Meta’s VR/AR Headset Lead Over Apple,"Feb 14, 2024"
News Report,"BlackRock Now Has Over 100,000 Bitcoin Under Management","Feb 14, 2024"
Analysis,3 Cryptos to Gift Your Loved One on Valentine’s Day,"Feb 14, 2024"
News Report,Crypto Total Market Capitalization Surpasses $2 Trillion,"Feb 14, 2024"
News Report,Will This Ripple Custody Company Aid CBDC Efforts in Struggling Economies?,"Feb 14, 2024"
News Report,"Spot Bitcoin Trading Reigns Supreme on Robinhood, 95% of Trades Bypass ETFs","Feb 14, 2024"
News Report,These Are the 1.3 Million Wallets Eligible for Starknet’s STRK Token Airdrop,"Feb 14, 2024"
News Report,Bitcoin Ransomware Attack Paralyzes 25 Romanian Hospitals,"Feb 14, 2024"
News Report,Angel Drainer Strikes Again: $400k Pilfered from Safe Vault Wallets,"Feb 14, 2024"
News Report,Grayscale’s GBTC Liquidation: More Than Meets the Eye,"Feb 14, 2024"
News Report,Why Are All These South Korean Celebrities Tied Up in a Crypto Scam? ,"Feb 14, 2024"
