News Report,Headline,Date
Analysis,Why Polygon (MATIC) Price Might Dip 10% by the End of March,"Mar 22, 2024"
News Report,"AIOZ Network Makes Strides in Asia, Partners With Alibaba","Mar 22, 2024"
Analysis,Is the Solana (SOL) Price Consolidating Before Pushing to New Highs?,"Mar 22, 2024"
Analysis,Internet Computer (ICP) Price Prediction: $15 by the End of March?,"Mar 22, 2024"
News Report,Why Base’s Rapid Growth is a Double-Edged Sword for Coinbase,"Mar 22, 2024"
Analysis,Reserve Rights (RSR) Price Surges 52% – Sustainable or Short-Lived?,"Mar 22, 2024"
News Report,New Vulnerability in Apple MacBook Allows Hackers to Steal Cryptos,"Mar 22, 2024"
Analysis,Cardano (ADA) Price Correction: Will It Continue or Reverse?,"Mar 22, 2024"
News Report,Estonia Approved Crypto Regulation as OKX Exits India,"Mar 22, 2024"
Analysis,Are Gold Investors Turning to Bitcoin? Analyzing ETF Market Trends,"Mar 22, 2024"
News Report,US DOJ Takes Apple to Court For Monopolising App Store: Win for Crypto Apps?,"Mar 22, 2024"
News Report,"Chainlink, Cardano, Polkadot Amongst Most Developed Altcoins","Mar 21, 2024"
News Report,Crypto Traders Shift Focus From Solana to Coinbase’s Base Meme Coins,"Mar 21, 2024"
Analysis,XRP Price Could See More Downside Due to these 2 Key Metrics,"Mar 21, 2024"
News Report,US Crypto Bill Might Pass Before Presidential Elections,"Mar 21, 2024"
News Report,Coinbase Legal Officer Explains Why Ethereum Is Not a Security,"Mar 21, 2024"
