News Report,Headline,Date
News Report,$230 Million Liquidated Amid Crypto Market Volatility,"Jan 10, 2024"
Analysis,Chainlink (LINK) Price Bounces – Can It Break out of This Long-Term Pattern?,"Jan 10, 2024"
News Report,Turkey Nears Final Stage of Crypto Regulation to Ensure Safety and Reduce Risks,"Jan 10, 2024"
Analysis,Litecoin (LTC) at 570-Day Support: Is a Market Reversal on the Horizon?,"Jan 10, 2024"
News Report,Why This Grayscale Crypto Fund Can Be Bullish for Ripple (XRP) Investors,"Jan 10, 2024"
News Report,Bitcoin Price Correction Imminent as Miners Enter Selling Spree,"Jan 10, 2024"
News Report,"Richard Heart ‘Reappears’ With High-Profile Lawyers, HEX Tokens Jump Double-Digits","Jan 10, 2024"
News Report,Could Polygon (MATIC) Emerge as a Dark Horse in 2024?,"Jan 10, 2024"
News Report,Ethereum Outperforms as Crypto Markets Navigate Volatile Waters,"Jan 10, 2024"
News Report,Celsius Network Offers Settlement Plan for Large Account Holders Amid Bankruptcy Proceedings,"Jan 10, 2024"
News Report,Coinbase Extends Offer to Assist SEC With Cybersecurity After X Account Hack,"Jan 10, 2024"
News Report,"AI Crypto Tokens, A Winner in Recent Times: Report","Jan 10, 2024"
News Report,Was SEC Behind Fake Bitcoin ETF Approval Tweet? Crypto Pundits Weigh In,"Jan 10, 2024"
News Report,US Financial Industry Regulator Spotlights Crypto in Annual Report,"Jan 10, 2024"
News Report,"SEC Social Media Hacked, Spreads False News on Bitcoin ETF Approval","Jan 9, 2024"
News Report,Industry Experts Anticipate No Institutional Demand for Ethereum ETFs,"Jan 9, 2024"
