News Report,Headline,Date
News Report,US Treasury Department Admits Greater Use of US Dollar in Money Laundering Than Crypto,"Feb 8, 2024"
News Report,Institutional Crypto Presence Expands in UAE With $250 Million Digital Asset Platform,"Feb 8, 2024"
News Report,Security Firm Exposes 3 Telegram Channels Promoting Crypto Scams,"Feb 8, 2024"
News Report,"Bitcoin and Artificial Intelligence Are Overhyped, Says Financial Analyst Gary Shilling","Feb 8, 2024"
Analysis,Cardano (ADA) Price Forecast: More Declines Ahead in February?,"Feb 8, 2024"
News Report,This Web3 Game Developer is Under Legal Lenses in South Korea,"Feb 8, 2024"
Analysis,"Bitcoin Heads to $50,000 As Selling Pressure Decreases","Feb 8, 2024"
News Report,Can Disney Revive Metaverse Push With $1.5 Billion Gaming Universe?,"Feb 8, 2024"
News Report,India Advances E-Rupee CBDC Features While Keeping Tight Grip on Crypto Sector,"Feb 8, 2024"
News Report,NBA in Legal Hot Water: Lawsuit Filed Over Voyager Crypto Exchange Deal,"Feb 8, 2024"
News Report,Can MicroStrategy Stock Be a Competitive Alternative to Bitcoin ETFs?,"Feb 8, 2024"
News Report,Crypto Is No Longer a Gamble for Most Americans: Survey,"Feb 8, 2024"
News Report,Outcast Chinese Bitcoin Miners Migrate to Africa to Capitalize on Cheap Electricity,"Feb 8, 2024"
News Report,Are Stablecoin Regulations on the Verge of Being Passed in the United States?,"Feb 8, 2024"
News Report,Ethereum Staking Hits Record Milestone 25% of Total ETH Supply,"Feb 8, 2024"
News Report,Conflict of Interest Concerns Raised as FTX and Celsius CEOs Employ Same Legal Team,"Feb 8, 2024"
