News Report,Headline,Date
Analysis,Aptos (APT) Recovery Effort: Can Price Overcome Recent Multi-Week Lows?,"Apr 11, 2024"
Analysis,"Crypto Whales Accumulate Ethereum: Will Price Surge to $4,400?","Apr 11, 2024"
News Report,From Paraguay to Wall Street: Bitcoin Halving Drives Mining Strategy and Policy,"Apr 11, 2024"
News Report,AI Tokens Surge: Bittensor (TAO) & Toncoin (TON) Make Waves,"Apr 11, 2024"
Analysis,Cardano (ADA) Faces 30% Price Cut: Is Another Decline on the Horizon?,"Apr 11, 2024"
News Report,"Voyager Digital Rallies $484 Million in Recovery Efforts, Aims for Rapid Creditor Repayment","Apr 11, 2024"
Analysis,Worldcoin (WLD) Bounces off Key Support – $8 Next?,"Apr 11, 2024"
News Report,Solana’s DeFi Protocol Marginfi’s TVL Declines 25% Due to CEO’s Resignation,"Apr 11, 2024"
News Report,Uniswap vs. the SEC: Crypto Leaders Demand Regulatory Clarity,"Apr 11, 2024"
News Report,"GBTC Outflows Slow Down, Signaling Potential Turnaround for Bitcoin Market","Apr 11, 2024"
News Report,"Bitcoin Meme Coin PUPS Hits All-Time High, NFT Sales Soar Ahead of Halving","Apr 11, 2024"
News Report,The Hidden War in Solana: DDoS Attacks Between Competitors,"Apr 11, 2024"
Feature,Bitcoin’s Bullish Trend Persists as Halving Nears Despite Volatility,"Apr 11, 2024"
News Report,Fitness App STEPN (GMT) Reveals $30 Million Crypto Airdrop,"Apr 10, 2024"
Analysis,Tron (TRX) Analysis: Here’s When a Recovery Rally May Occur,"Apr 10, 2024"
Analysis,Bearish Signals Spook PEPE Enthusiasts: Is a Significant Price Correction Imminent?,"Apr 10, 2024"
