News Report,Headline,Date
News Report,91% of Coinbase’s Base Meme Coins at Risk: Vulnerabilities Exposed,"Apr 8, 2024"
News Report,50% of Solana Presale Tokens Were Malicious: Research,"Apr 8, 2024"
News Report,Ethena Labs’ USDe Increases Rewards to Users by 50%,"Apr 8, 2024"
Analysis,On-Chain Metrics Suggest Shiba Inu (SHIB) Price Is Set to Soar by 42%,"Apr 8, 2024"
Analysis,Bitcoin Miners Struggle to Maintain Operations Ahead of the Halving,"Apr 8, 2024"
Analysis,Ripple (XRP) Price Correction Looms as Institutions Pull Away,"Apr 8, 2024"
Analysis,Cardano (ADA) Breakout Signals: Brace for 32% Rally Ahead,"Apr 8, 2024"
News Report,NFT and Gaming Tokens to List on Top Exchanges: Sector Revival?,"Apr 8, 2024"
Analysis,Dogecoin in the Danger Zone: How Bearish Reversal Could Slash Prices by 40%,"Apr 8, 2024"
News Report,ParaSwap Hack Updates: DAO Approves Recovery Fund for Victims,"Apr 8, 2024"
News Report,Why Charles Hoskinson is Bullish on These Two Cardano Upgrades,"Apr 8, 2024"
Analysis,"Bitcoin (BTC) Breaks Key Resistance: $85,000 Next","Apr 8, 2024"
News Report,Cryptocurrency Users Beware: Etherscan Ads May Drain Your Wallet,"Apr 8, 2024"
Analysis,Crypto Whales Buy $35 Million in Ethereum: Price Impact,"Apr 8, 2024"
News Report,"Base’s TVL Soars Past $4 Billion, Beating Out Arbitrum and Optimism Growth","Apr 8, 2024"
News Report,Crypto vs. TradFi: Tether’s 2023 Earnings Rival World’s Largest Banks,"Apr 8, 2024"
