News Report,Headline,Date
Analysis,Is Bitcoin (BTC) Price Headed for a Sharp Downturn? Key Indicators Examined,"Apr 10, 2024"
News Report,"Uniswap’s UNI Tumbles After SEC Issues Wells Notice, Legal Battle Looms","Apr 10, 2024"
Analysis,Dogecoin (DOGE) at Risk: Factors Leading to a Potential Correction,"Apr 10, 2024"
Analysis,Fantom (FTM) Price Accumulation: Catalyst for a 55% Rally?,"Apr 10, 2024"
News Report,"VanEck CEO Anticipates Rejection for Spot Ethereum ETF, Despite Its Early Filing","Apr 10, 2024"
Analysis,Injective (INJ) Price Consolidation: A Prelude to a Push Towards $40?,"Apr 10, 2024"
News Report,Friend.Tech Attempts to Rise From the Dead: Total Value Locked Shoots Up 25%,"Apr 10, 2024"
Analysis,Polkadot (DOT) Price Eyes $10: A Critical Factor Points to Potential Gains,"Apr 10, 2024"
News Report,"Bitcoin Retreats Amid ETF Outflows, Market Awaits CPI Report","Apr 10, 2024"
News Report,US Senators Gillibrand and Lummis Set to Unveil a New Stablecoin Legislation,"Apr 10, 2024"
Analysis,Ripple (XRP) Price Correction: How Long Will the Downtrend Last?,"Apr 10, 2024"
News Report,Fixing Solana’s Speed: New Proposal Targets Transaction Time Improvement,"Apr 10, 2024"
News Report,Google Cloud Deepens Blockchain Footprint With EigenLayer Mainnet Node Operation,"Apr 10, 2024"
Analysis,Arkham’s ARKM Token Tumbles 20% Amid Market Skepticism and Controversy,"Apr 10, 2024"
News Report,"Toncoin (TON) Hits New All-Time High, Knocking Cardano (ADA) Out of Top 10","Apr 10, 2024"
Analysis,Shiba Inu (SHIB) Break From Bitcoin Signals Market Strength,"Apr 9, 2024"
