News Report,Headline,Date
News Report,This Crypto Firm Faces a $3M Fine for Selling Digital Assets Without License,"Feb 8, 2024"
Feature,Inside Fantom’s Strategy to Build a Decentralized Tomorrow,"Feb 7, 2024"
News Report,"Ethereum’s Dencun Upgrade Triumphs in Testnet, Eyes Mainnet Horizon","Feb 7, 2024"
Analysis,"Bitcoin Will Never Drop Below $40,000 Again: Analyst Predicts Parabolic Move","Feb 7, 2024"
Analysis,Ethereum (ETH) Price Forecast: Bullish Rebound Signals Upward Momentum,"Feb 7, 2024"
Analysis,Shiba Inu’s (SHIB) Price Trends Down for 2-Months: What’s Behind the Slide?,"Feb 7, 2024"
News Report,"Solana Is “Centralized Garbage,” Says Crypto Industry Leader","Feb 7, 2024"
News Report,DeFi Total Value Locked Hits $60 Billion – These Protocols Are Leading the Charge,"Feb 7, 2024"
News Report,Virginia Bill Proposes Crypto and Blockchain Study Group: What Could It Mean?,"Feb 7, 2024"
Analysis,This Altcoin Is Up 80% in the Last Few Hours,"Feb 7, 2024"
Analysis,These Analysts Believe Polygon (MATIC) Will Soon Find its Footing – This is Why,"Feb 7, 2024"
Analysis,Ripple (XRP) Breaks Ascending Support: What’s Next for the Price?,"Feb 7, 2024"
News Report,The World’s Third Largest Crypto Exchange Faces Criminal Investigation After Breaking the Law,"Feb 7, 2024"
News Report,You Could Face Life in Prison Under South Korea’s New Crypto Regulation,"Feb 7, 2024"
News Report,Another Crypto-Friendly Bank Sunsets Digital Asset Services and Support,"Feb 7, 2024"
News Report,Ronin (RON) Price Dump: Nansen Report Points Finger at Arca Investments,"Feb 7, 2024"
