News Report,Headline,Date
News Report,Binance Labs Winners Showcase Web3’s Expanding Horizons,"Mar 8, 2024"
News Report,Coinbase Issues Stark Warning Against AI Tokens Hype,"Mar 8, 2024"
Analysis,Polkadot (DOT) Price Could Dip Below $10 – Here’s Why,"Mar 8, 2024"
Analysis,"Bitcoin Records New All-Time High at $70,000: What’s Next?","Mar 8, 2024"
Analysis,THORChain (RUNE) Price Leaps 50%: Could Bears Hamper The Bullish Momentum?,"Mar 8, 2024"
News Report,Bitcoin Demand by ETFs at Record Highs Reveals New Bullish Target,"Mar 8, 2024"
Analysis,This Metric Could Threaten the Ethereum (ETH) Price Push to an All-Time High,"Mar 8, 2024"
Analysis,Solana (SOL) Price Hits Two-Year High but Remains Undervalued – Here’s Why,"Mar 8, 2024"
News Report,Crypto Ransomware & Tornado Cash Emerge as Standouts in Cybercrime: Chainalysis,"Mar 8, 2024"
News Report,US Fights to Convict This Crypto Kingpin Before Extradition to South Korea,"Mar 8, 2024"
News Report,Base Predicts Up to 100x Ethereum Fee Reduction After Dencun Fork,"Mar 8, 2024"
News Report,Fed’s Powell Says Digital Dollar on Back Burner Despite Recent Leaked Comments,"Mar 8, 2024"
Analysis,MATIC Price Hits $1.17: Will Its Correlation With ETH Continue?,"Mar 8, 2024"
Analysis,"DOGE Price Surged 95%, Could Profit Taking Lead to a Dip?","Mar 8, 2024"
Feature,Kraken VP of Growth Explains Why This Crypto Bull Run Is Unlike Any Other,"Mar 8, 2024"
Analysis,This Is Why Cardano (ADA) Price Is Potentially on the Cusp of a 15% Correction,"Mar 7, 2024"
