index,Headline,Date,pred_score,Headline_x,Headline_y
2513,,22-Dec-23,0.0,Will Ripple (XRP) Close Out 2023 on a High? Analysts Unsure of Future Trend,Will Ripple (XRP) Close Out 2023 on a High? Analysts Unsure of Future Trend
2514,,22-Dec-23,-0.3,Cardano (ADA) Struggles After Yearly High—Levels to Watch as Year Ends,Cardano (ADA) Struggles After Yearly High—Levels to Watch as Year Ends
2515,,22-Dec-23,0.0,Bitcoin’s Balancing Act: Here’s How This Resistance Level Could Dictate the Trend Ahead,Bitcoin’s Balancing Act: Here’s How This Resistance Level Could Dictate the Trend Ahead
2516,,22-Dec-23,0.6,"Solana Inches Closer to $100, Overtakes BNB in Market Cap Rankings","Solana Inches Closer to $100, Overtakes BNB in Market Cap Rankings"
2517,,22-Dec-23,0.1,"$1.1 Billion in Bitcoin Options Due to Expire—Will BTC Reclaim $45,000?","$1.1 Billion in Bitcoin Options Due to Expire—Will BTC Reclaim $45,000?"
2518,,22-Dec-23,0.7,"BlackRock to Appoint Third-Party to Buy BTC, Analysts Eye January 10 ETF Approvals ","BlackRock to Appoint Third-Party to Buy BTC, Analysts Eye January 10 ETF Approvals "
2519,,22-Dec-23,0.8,Marathon Digital Stock Soars in 2023 Ahead of Bitcoin Halving,Marathon Digital Stock Soars in 2023 Ahead of Bitcoin Halving
2520,,22-Dec-23,-0.9,Rogue $58M Crypto Hack on Google Search and Social Media,Rogue $58M Crypto Hack on Google Search and Social Media
2521,,21-Dec-23,0.7,"Bitcoin Approved in Argentina for Contractual Deals, Says Foreign Chief","Bitcoin Approved in Argentina for Contractual Deals, Says Foreign Chief"
2522,,21-Dec-23,-0.6,Crypto Crime: How Global Law Enforcement is Learning to Fight Back,Crypto Crime: How Global Law Enforcement is Learning to Fight Back
2523,,21-Dec-23,0.8,NEAR Price Reaches 440-Day High—What’s Driving Momentum?,NEAR Price Reaches 440-Day High—What’s Driving Momentum?
2524,,21-Dec-23,-0.4,Worldcoin Stops Orb Verification Services in India Amid Growing Demand: Reports,Worldcoin Stops Orb Verification Services in India Amid Growing Demand: Reports
2525,,21-Dec-23,0.7,Avalanche (AVAX) Increased 115% in December—Is $50 Within Reach?,Avalanche (AVAX) Increased 115% in December—Is $50 Within Reach?
2526,,21-Dec-23,-0.7,Is Ethereum Dead: 2023 Underperformance Against BTC Sparks Community Debate,Is Ethereum Dead: 2023 Underperformance Against BTC Sparks Community Debate
2527,,21-Dec-23,0.8,Immutable (IMX) Increase Leads to Highest Price in Over 600 Days,Immutable (IMX) Increase Leads to Highest Price in Over 600 Days
2528,,21-Dec-23,0.1,"Grayscale Meets SEC Again, CEO Says Commission Should Approve All at Once","Grayscale Meets SEC Again, CEO Says Commission Should Approve All at Once"
2529,,09-Feb-21,0.3,What’s Next for TOMO After All-Time High Price?,What’s Next for TOMO After All-Time High Price?
2530,,09-Feb-21,0.1,Bank of Korea Plans to Test the Adoption of CBDCs,Bank of Korea Plans to Test the Adoption of CBDCs
2531,,09-Feb-21,0.0,A New US Tech Strategy for the Biden-Harris Administration: Report,A New US Tech Strategy for the Biden-Harris Administration: Report
2532,,09-Feb-21,0.2,OMG Network (OMG) Approaches Long-Term Resistance at $6.50,OMG Network (OMG) Approaches Long-Term Resistance at $6.50
2533,,09-Feb-21,0.4,Dogecoin and Litecoin Mining Chip Combo Capitalizes on the Craze,Dogecoin and Litecoin Mining Chip Combo Capitalizes on the Craze
2534,,09-Feb-21,0.3,Zcash (ZEC) Aims to Move Above Massive Horizontal Resistance,Zcash (ZEC) Aims to Move Above Massive Horizontal Resistance
2535,,09-Feb-21,0.5,Ethereum Tops Bitcoin in Weekly Inflows with $195 Million in February,Ethereum Tops Bitcoin in Weekly Inflows with $195 Million in February
2536,,09-Feb-21,0.9,Bitcoin Smashes Resistance to Reach Another All-Time High,Bitcoin Smashes Resistance to Reach Another All-Time High
2537,,09-Feb-21,0.8,"How EIP-1559 Could Send Ethereum Prices to $20,000","How EIP-1559 Could Send Ethereum Prices to $20,000"
2538,,09-Feb-21,0.6,Ethereum Mining Revenue Hits All-Time High Alongside Gas Prices,Ethereum Mining Revenue Hits All-Time High Alongside Gas Prices
2539,,08-Feb-21,0.9,"Bitcoin Passes $43,000, Heading for New All-Time High","Bitcoin Passes $43,000, Heading for New All-Time High"
2540,,08-Feb-21,0.3,Five Biggest Gainers From Feb. 1 – Feb 8.,Five Biggest Gainers From Feb. 1 – Feb 8.
2541,,08-Feb-21,0.9,High-Flying Terra (LUNA) Outperforms Entire Top 100 With 60% Gain,High-Flying Terra (LUNA) Outperforms Entire Top 100 With 60% Gain
2542,,08-Feb-21,0.6,"Ethereum Futures Go Live on CME, More Than 200 Contracts Traded","Ethereum Futures Go Live on CME, More Than 200 Contracts Traded"
2543,,08-Feb-21,-0.5,Nigeria’s Central Bank Justifies Its Stance On Crypto Ban,Nigeria’s Central Bank Justifies Its Stance On Crypto Ban
2544,,08-Feb-21,0.7,Grayscale Added 150% of All Bitcoin Mined in January,Grayscale Added 150% of All Bitcoin Mined in January
2545,,08-Feb-21,0.6,Crypto Exchanges Witness Second-Largest Traffic Volume in 3 Years,Crypto Exchanges Witness Second-Largest Traffic Volume in 3 Years
2546,,08-Feb-21,0.8,"Tesla Confirms $1.5B Bitcoin Purchase, BTC Cruises Through $42k","Tesla Confirms $1.5B Bitcoin Purchase, BTC Cruises Through $42k"
2547,,08-Feb-21,0.2,Bitcoin Whales Increase Their Stake as Exchange Reserves Shrink,Bitcoin Whales Increase Their Stake as Exchange Reserves Shrink
2548,,08-Feb-21,0.3,Bridge Mutual Is Bringing DeFi Risk Coverage to Ferrum Network,Bridge Mutual Is Bringing DeFi Risk Coverage to Ferrum Network
2549,,08-Feb-21,0.5,Injective Partners with Huobi ECO Chain to Accelerate DeFi Derivatives,Injective Partners with Huobi ECO Chain to Accelerate DeFi Derivatives
2550,,08-Feb-21,-0.6,Yearn Finance Pushes DeFi Insurance Following Flash Loan Attack,Yearn Finance Pushes DeFi Insurance Following Flash Loan Attack
2551,Elon Musk Taps Crypto as the Future of Currency on Earth,07-Feb-21,0.8,,
2552,MicroStrategy Opens the Playbook on Corporate BTC,07-Feb-21,0.1,,
2553,Bitcoin Futures World-Wide Hit $14 Billion for the First Time,07-Feb-21,0.7,,
2554,Celsius Raises the Ante with Self-Insurance,07-Feb-21,0.3,,
2555,Badger DAO Leaps 700% in 30 Days,07-Feb-21,0.9,,
2556,ADA Overtakes XRP as Fourth Largest Cryptocurrency,07-Feb-21,0.6,,
2557,DMM Swap Shutters Amid Unclear Regulatory Concerns,07-Feb-21,-0.7,,
2558,DOGE up as Gene Simmons Calls Himself “God of Dogecoin”,07-Feb-21,0.5,,
2559,"Ethereum Surpasses Wells Fargo, Morgan Stanley, AmEx",06-Feb-21,0.6,,
2560,Bitfinex Closes Tether Loan Early with $550 Million Payment,06-Feb-21,0.4,,
2561,Binance Coin (BNB) Passes LTC; Now 7th by Market Cap,06-Feb-21,0.6,,
2562,Cardano Jumps on Multi-Asset Main Chain Transactions,06-Feb-21,0.3,,
2563,"Bitcoin Bullish as it Breaks $40,000, New ATH Incoming?",06-Feb-21,0.8,,
2564,VET and its History Of Price Movements,06-Feb-21,0.1,,
2565,"BeInCrypto Weekly News Roundup – February 5, 2021",05-Feb-21,0.1,,
2566,5 DeFi Categories to Pay Attention to This Alt-Season,05-Feb-21,0.1,,
2567,Gas Fees Soar as Ethereum (ETH) Reaches New All-Time High,05-Feb-21,-0.4,,
2568,"Bitcoin’s Seizure-Resistance Shines, Authorities Fail to Crack $60M Wallet",05-Feb-21,0.4,,
2569,Stellar (XLM) Poised to Break Out? – A Price History,05-Feb-21,0.1,,
2570,"GameStop Stock Returns to Earth, Robinhood Lifts Trading Ban",05-Feb-21,-0.3,,
2571,Tezos (XTZ) Approaches 2.5 Year High – A Price History,05-Feb-21,0.6,,
2572,Chainlink (LINK) Tops $27 for First Time — A Price History,05-Feb-21,0.7,,
2573,Grayscale AUM Surpasses $30 Billion After Latest ETH Purchase,05-Feb-21,0.7,,
2574,Cardano (ADA) Climbs to Three-Year High — A Price History,05-Feb-21,0.7,,
2575,Theta Network Joins DEX Race with ThetaSwap Launch,05-Feb-21,0.3,,
2576,PayPal Plans Crypto Commerce Expansion to Venmo,05-Feb-21,0.4,,
2577,"Yearn Finance Dai Vault Exploited For $11 Million, YFI Dumps",05-Feb-21,-0.9,,
2578,Study: Elon Musk Crypto Tweets Lead to Abnormal Returns,04-Feb-21,0.2,,
2579,"AAVE Breaks $500, Mark Cuban Confirms the Token in His Portfolio",04-Feb-21,0.7,,
2580,Top 20 Dogecoin Addresses Hold Over 50% of DOGE Supply,04-Feb-21,-0.2,,
2581,"BiC Crypto Video News Show: ETH Bullish Trend, Crashing Bitcoin Dominance, What’s Next?",04-Feb-21,0.1,,
2582,"Elon Musk Shills Dogecoin (DOGE), Pumps Another 50%",04-Feb-21,0.6,,
2583,"Reddit’s WallStreetBets Traders Did Not Pump Silver and XRP, So Who Did?",04-Feb-21,0.0,,
2584,"75 ETH 2.0 Validators Double Vote, Lose $30,000 to Penalties",04-Feb-21,-0.6,,
2585,"Americans Can’t Get Enough Crypto, Japanese Investors Still Cautious: Bitflyer Report",04-Feb-21,0.1,,
2586,UNI Hovers Near All-Time High: A History of Price Movements,04-Feb-21,0.6,,
2587,A History of Binance Coin (BNB) Price Movements,04-Feb-21,0.1,,
2588,Pro-Crypto Senator Appointed to US Banking Committee,04-Feb-21,0.4,,
2589,"DeFi TVL Breaks All-Time High, Surpassing $32 Billion",04-Feb-21,0.7,,
2590,Instadapp Actions Automates DeFi for Liquidation Protection,04-Feb-21,0.3,,
2591,"DeFi Farmers Flock to Flamingo, Binance Smart Chain Amid Spiking Gas Costs",04-Feb-21,0.1,,
2592,DOT Teeters on the Brink of ATH – A History of Price Movements,03-Feb-21,0.6,,
2593,Visa Announces Plan to Help Banks Roll Out Bitcoin and Trading Services,03-Feb-21,0.8,,
2594,"Binance Unveils PayPal Competitor, Binance Pay with BTC, ETH, BNB",03-Feb-21,0.5,,
2595,Guggenheim CIO Suggests Bitcoin Fair Value Between $400k – $600k,03-Feb-21,0.8,,
2596,XRP Continues Range Trading in Uncertain Trend,03-Feb-21,0.1,,
2597,Bitcoin Supply in Exchange Wallets Reaches 2.5 Year Low,03-Feb-21,-0.2,,
2598,TOMO Approaches All-Time High Price and Nearly Breaks Out,03-Feb-21,0.7,,
2599,Bitcoin May Eclipse 1 Billion Users Over Next 4 Years Says Willy Woo,03-Feb-21,0.5,,
2600,Crypto Vs Oil: What Should We Expect in 2021?,03-Feb-21,0.1,,
2601,"Brave Records Twofold Increase, Surpassing 25 Million Active Users",03-Feb-21,0.7,,
2602,Ethereum Celebrates New All-Time High After Three Years,03-Feb-21,0.8,,
2603,Ethereum Becomes Third-Most Staked Token Amid New Price Highs,03-Feb-21,0.7,,
2604,Bitcoin Dominance Rate Continues Tumbling as Altcoins Flourish,03-Feb-21,0.3,,
2605,Ren Protocol and Alameda Research Join Forces to Boost Solana Functionality,03-Feb-21,0.6,,
2606,Federal Reserve Payments Pilot Incorporates Ripple Partner Volante Technologies,03-Feb-21,0.5,,
2607,Balancer Unveils Version 2 Specs and Launch Date,03-Feb-21,0.2,,
2608,MicroStrategy Grows Bitcoin Stash After Purchasing Additional $10 Million,02-Feb-21,0.6,,
2609,"Yearn.Finance to Mint 6,666 New YFI Tokens to Reward Contributors",02-Feb-21,0.4,,
2610,Second-Largest Stablecoin USDC Transitions to the Stellar Blockchain,02-Feb-21,0.5,,
2611,"Ethereum (ETH) Prepares to Smash Through the $1,500 Barrier",02-Feb-21,0.6,,
2612,"BiC Crypto Video News Show: XRP Pump and Dumps, How Will Regulators Respond?",02-Feb-21,-0.3,,
2613,"Gemini Introduces Crypto Interest Solution, Goes Head to Head with DeFi",02-Feb-21,0.4,,
2614,Stellar (XLM) Rallies Significantly Before Long-Term Rejection,02-Feb-21,-0.2,,
2615,Robinhood CEO to Testify Before Congress Over GameStop Debacle,02-Feb-21,-0.4,,
2616,Algorand (ALGO) Climbs to Revisit $0.70 Resistance,02-Feb-21,0.3,,
2617,US Senator Expresses Her Support for Bitcoin,02-Feb-21,0.7,,
2618,Binance Coin (BNB) Flies to New All-Time High,02-Feb-21,0.8,,
2619,Grayscale Ethereum Trust Reopened to Investors and Traders,02-Feb-21,0.5,,
2620,Solana (SOL) Climbs to New All-Time High Price,02-Feb-21,0.8,,
2621,Alpha Homora DeFi Leverage Platform Launches Version 2 Update,02-Feb-21,0.2,,
2622,"Bitcoin Fails to Close Above $34,000 Resistance",02-Feb-21,-0.5,,
2623,DFI Money Merges with SakeSwap to Combine DeFi Forces,02-Feb-21,0.6,,
2624,Publicly-Traded Kronos Accepts Dogecoin as Payment Method,01-Feb-21,0.6,,
2625,XRP Faces More Exchange Suspensions Following Pump & Dump Activity,01-Feb-21,-0.7,,
2626,Swiss Firms Tokenize Premium Wines Under New DLT Law,01-Feb-21,0.1,,
2627,Bitcoin Miners Banked More Than $1 Billion in January,01-Feb-21,0.7,,
2628,Circle’s USDC Stablecoin Market Cap Grows 50% Year to Date,01-Feb-21,0.6,,
2629,Melvin Capital Posts 53% Jan Loss Led by GameStop Shorts,01-Feb-21,-0.8,,
2630,KISS Co-Founder Climbs Aboard XRP and Dogecoin Buying Spree,01-Feb-21,0.4,,
2631,"SXP Reclaims Resistance, Aims for at Least $2",01-Feb-21,0.5,,
2632,Five Biggest Altcoin Gainers From Jan. 25 – Feb. 1,01-Feb-21,0.2,,
2633,XRP Records Highest Social Volume Gains Since 2018,01-Feb-21,0.5,,
2634,Top Five Aspiring Crypto Coins for February,01-Feb-21,0.2,,
2635,Bitcoin Shows Bearish Signs with Failed Breakout,01-Feb-21,-0.4,,
2636,TrustSwap DeFi Protocol Aims to Clean up the Crypto Space,01-Feb-21,0.4,,
2637,Crypto Art and NFT Scene Primed to Surge in 2021,01-Feb-21,0.6,,
2638,Stellar Lumens (XLM) Team Releases Its 2021 Roadmap,31-Jan-21,0.2,,
2639,r/Bitcoin adds 100k+ Members in One Day,31-Jan-21,0.7,,
2640,Bridge Mutual Tops DeFi Insurance Market in One Day,31-Jan-21,0.6,,
2641,Hartnett Describes Bull Market Ending Catalysts,31-Jan-21,-0.3,,
2642,Grayscale Bitcoin Fund in Emerald Mutual Holdings,31-Jan-21,0.1,,
2643,SushiSwap Breaks $1 Billion Market Cap After 278% Rally,31-Jan-21,0.8,,
2644,UNI and COMP Hit ATHs as DeFi Nears $30 Billion TVL,31-Jan-21,0.8,,
2645,XRP Surges 50% After Ripple Files SEC Response,31-Jan-21,0.7,,
2646,US Federal Reserve Lists CBDC Post on LinkedIn,30-Jan-21,0.1,,
2647,Anthony Pompliano Calls Trading Halts “Un-American”,30-Jan-21,-0.3,,
2648,India Looks to Ban Private Cryptocurrencies,30-Jan-21,-0.7,,
2649,How Reddit Traders Rekt Wall Street and Thrust Crypto Into the Global Spotlight,30-Jan-21,0.3,,
2650,Visa CEO Signals Crypto Payments Support,30-Jan-21,0.6,,
2651,Ripple Labs Files Rebuttal to SEC Charges,30-Jan-21,0.0,,
2652,Robinhood Restricts Crypto Trades Due to DOGE Rally,30-Jan-21,-0.5,,
2653,"BeInCrypto Weekly News Roundup: January 29, 2021",29-Jan-21,0.1,,
2654,Tron’s Justin Sun Vows to Buy $10 Million in GameStop Stock,29-Jan-21,0.3,,
2655,Tellor (TRB) Fails to Break Out Above $35 Resistance,29-Jan-21,-0.3,,
2656,5 DeFi-Related Indicators to Watch During This Bull Run,29-Jan-21,0.1,,
2657,2021 Global Report Finds Confidence in Crypto Stronger Than Ever,29-Jan-21,0.7,,
2658,"Bitcoin Soars Past $37,000 as Elon Musk Changes His Twitter Bio",29-Jan-21,0.8,,
2659,US Congressman Files Petition to Investigate Robinhood & Melvin Capital,29-Jan-21,-0.4,,
2660,"Doge Does a GameStop, Redditors Pump Meme Coin Into the Top 10",29-Jan-21,0.6,,
2661,Yearn Finance Revives yETH Vault but Early Yields Disappoint,29-Jan-21,-0.2,,
2662,WEF ‘Resetting Digital Currencies’ Panelists Reveal Reasons for Cryptocurrency Reticence,29-Jan-21,-0.3,,
2663,Origin Protocol (OGN) Breaks Out After Completing Bullish Pattern,29-Jan-21,0.5,,
2664,Top-Tier Bitcoin Whale Moves Nearly $1 Billion for $5 Fee,29-Jan-21,0.2,,
2665,"Grayscale Pivots to DeFi with Aave, Polkadot Trust Filings",29-Jan-21,0.4,,
2666,Bitcoin Double Bottom Leads to Hefty Bounce,29-Jan-21,0.6,,
2667,Robinhood Suspends Stock Trading Due to ‘Volatility’,28-Jan-21,-0.6,,
2668,Dogecoin (Doge) Surges Over 250% as Redditors Move Into Crypto,28-Jan-21,0.7,,
2669,SushiSwap Suffers Another Attack. Hacker Steals 81 Eth,28-Jan-21,-0.7,,
2670,BiC’s Crypto Video News Show: The Wall Street vs. Main Street Battle Makes Bitcoin Stronger,28-Jan-21,0.3,,
2671,"Ethereum’s (Eth) Next Rally Could Take It All the Way to $1,800",28-Jan-21,0.6,,
2672,Billionaire Mark Cuban Releases Personal NFTs,28-Jan-21,0.2,,
2673,SoviFinance AMA With BeInCrypto,28-Jan-21,0.1,,
2674,Opium Network Launches Latest DeFi Token and New Distribution Model,28-Jan-21,0.2,,
2675,Elrond (EGLD) Pumps to New All-Time Highs in Bullish Sprint,28-Jan-21,0.8,,
2676,Ethereum Foundation Lands Reddit Partnership to Improve Scaling Technology,28-Jan-21,0.5,,
2677,Verge (XVG) Retests Breakout Level Signaling Potential Pump,28-Jan-21,0.4,,
2678,Blockstream Purchases $25M of Bitcoin Mining Hardware from MicroBT,28-Jan-21,0.4,,
2679,"Bitcoin Bounces at $29,000 After Taking a Tumble",28-Jan-21,-0.2,,
2680,Australia’s Biggest Exchange to Delist Bitcoin SV,28-Jan-21,-0.3,,
2681,What Impact Do Twitter Influencers Have on Crypto Prices?,28-Jan-21,0.1,,
2682,Bitcoin Wave Count Suggests a Bounce Toward Resistance,27-Jan-21,0.3,,
2683,Lulu Exchange Announces Partnership with Ripple and Federal Bank,27-Jan-21,0.5,,
2684,Ripple (XRP) Faces Class-Action Lawsuit From Investor That Lost $48,27-Jan-21,-0.4,,
2685,Badger DAO Has the Smallest TVL to Market Cap Ratio in the Top 10 DeFi Projects,27-Jan-21,0.1,,
2686,"Bitcoin Dips Below $30,000 as Markets Look Towards GameStop",27-Jan-21,-0.4,,
2687,Uniswap Token Eclipses $14 Alongside Exploding DeFi Market,27-Jan-21,0.7,,
2688,DEX Volume Explodes to $43.5 Billion in Just Over a Year,27-Jan-21,0.5,,
2689,Solana (SOL) Reaches Another Yearly High—Can It Reclaim $100 in 2023?,21-Dec-23,0.4,,
2690,Billion-Dollar Freeze: Three Arrows Capital Founders Hit with Major Asset Block,21-Dec-23,-0.8,,
2691,Billionaire Bill Gates Makes Big AI Predictions for 2024,21-Dec-23,0.1,,
2692,US Court Rejects SBF’s Plea to Extend Sentence Hearing,21-Dec-23,-0.3,,
2693,Crypto Will Play a Key Role in 2024 US Elections: Grayscale ,21-Dec-23,0.4,,
2694,Ripple Receives Greenlight Listing from Central Bank of Ireland,21-Dec-23,0.7,,
2695,South Korea’s Financial Chief Reportedly Plans Crypto Discussion with Gary Gensler,21-Dec-23,0.2,,
2696,BTC Price Prediction 2024: What Will Happen After Bitcoin ETFs Approval?,20-Dec-23,0.1,,
2697,China Unveils Four-Step Plan to Bolster Web3 and Crypto Industry,20-Dec-23,0.6,,
2698,UK Court Rules That AI Cannot Patent an Invention,20-Dec-23,-0.2,,
2699,These 2 Top Five Cryptos Are Being Chased Down by Solana,20-Dec-23,0.3,,
2700,America Struggles With Instant Payments – Is Ripple’s XRP the Solution?,20-Dec-23,0.1,,
2701,Can the Litecoin (LTC) Price Begin End-of-December Rally?,20-Dec-23,0.1,,
2702,What Are Top AI-Powered Cryptocurrencies to Watch Out For in 2024,20-Dec-23,0.1,,
2703,Thai Bank Will Allow Clients to Raise Funds Using Tokens,20-Dec-23,0.5,,
2704,Chainlink (LINK) Price Gives First Bearish Signs Since August – What’s Next?,20-Dec-23,-0.3,,
2705,DEX Volume Explodes to $43.5 Billion in Just Over a Year,27-Jan-21,0.7,,
2706,Band Protocol (BAND) Heads for Another Retest of Support,27-Jan-21,-0.2,,
2707,Five Biggest Altcoin Gainers From Jan. 18 – 25,27-Jan-21,0.1,,
2708,DeFi Protocol 0x (ZRX) Upgrades With Latest Gas-Busting Features,27-Jan-21,0.3,,
2709,Dogecoin Barks Up DeFi with DOGEO Stablecoin Minting,27-Jan-21,0.1,,
2710,0x (ZRX) Bounces Back but Fails to Clear Resistance,27-Jan-21,-0.2,,
2711,Philippines Central Bank Revisits Crypto Regulation,27-Jan-21,0.1,,
2712,Bitcoin (BTC) Continues Consolidation Phase Below Resistance,27-Jan-21,0.1,,
2713,Bitmain Co-founders Resolve Long-Standing Disagreement on Company’s Future,27-Jan-21,0.3,,
2714,NBA Top Shot NFT Sales Surpasses CryptoKitties,27-Jan-21,0.5,,
2715,Rothschild Investment Now Holds Over $1 Million in BTC through Grayscale Bitcoin Trust,27-Jan-21,0.5,,
2716,Ethereum Classic (ETC) Continues Consolidating Within a Range,26-Jan-21,0.1,,
2717,BiC’s Crypto Video News Show: Alt Season 2021 – Everything You Need to Know,26-Jan-21,0.1,,
2718,Stellar (XLM) Invests Big in Wyre With $5 Million Ecosystem Upgrade,26-Jan-21,0.7,,
2719,"A Digital Rupee Token May Be a Reality, Says Indian Central Bank",26-Jan-21,0.1,,
2720,ZIL Moves Above $0.1 But Cannot Sustain Rally,26-Jan-21,-0.2,,
2721,RippleNet Saw a 5x Increase in Growth Before SEC Troubles,26-Jan-21,0.5,,
2722,Coinbase Yearly Review Shows Growing Institutional Interest in Ethereum,26-Jan-21,0.5,,
2723,Have Major University Endowments Been Buying Bitcoin?,26-Jan-21,0.1,,
2724,"COTI Breaks Out Above Resistance, CTSI Could Follow Suit",26-Jan-21,0.3,,
2725,Janet Yellen Confirmed as First Woman US Treasury Secretary,26-Jan-21,0.1,,
2726,Cosmos (ATOM) Knocked Back After Reaching All-Time High,26-Jan-21,-0.3,,
2727,Balancer DeFi Protocol Battles Gas Fees with Reimbursement Plan,26-Jan-21,-0.2,,
2728,"Bitcoin Slips Back Toward $30,000 — Can it Rebound?",26-Jan-21,-0.1,,
2729,Crypto Twitter Enraptured by Gamestop Stock Pump,26-Jan-21,0.1,,
2730,Uniswap Hits New Milestones Amid Growing Prices and Social Media Attention,26-Jan-21,0.7,,
2731,"BEL Breaks Out Above $1, Could Increase All the Way to $3",25-Jan-21,0.8,,
2732,"Marathon Buys Dip, Adding $150 Million in Bitcoin",25-Jan-21,0.5,,
2733,"After Rejection, ADA Readies for Breakout Attempt",25-Jan-21,0.1,,
2734,Michael Saylor Believes the Tether Fud is Irrelevant and Can’t Stop Bitcoin,25-Jan-21,-0.3,,
2735,"Covid Passports are Here, and They’re on the Blockchain",25-Jan-21,0.1,,
2736,Russia Bans Public Officials from Holding Crypto Effective April 2021,25-Jan-21,-0.5,,
2737,"As Altcoins Rise, Bitcoin Dominance Shrinks to Lowest Levels Since Sep",25-Jan-21,-0.1,,
2738,"Ethereum Marks New High Price, Triggers Novogratz Prediction of $2,600",25-Jan-21,0.8,,
2739,Michael Saylor: More Bitcoin Regulation Will Accelerate Institutional Acceptance,25-Jan-21,0.5,,
2740,Chainlink (LINK) Pumps to New All-Time High in a Bullish Resurgence,25-Jan-21,0.9,,
2741,Multiple Cryptocurrency Firms Consider Going Public this Year,25-Jan-21,0.1,,
2742,Bitcoin Dominance Rate Attempts to Bounce Off Support,25-Jan-21,0.1,,
2743,Yearn Finance Seeks Tradeoff with YFI Minting Proposal,25-Jan-21,0.1,,
2744,Bitcoin (BTC) Bounces but Faces Crucial Resistance,25-Jan-21,0.1,,
2745,Ethereum Inches to New Peak Price as ETH Moves Off Exchanges,25-Jan-21,0.5,,
2746,SushiSwap BentoBox Addition Pushes SUSHI Token to New Heights,25-Jan-21,0.7,,
2747,WEF Davos 2021 has Cryptocurrency on the Agenda,24-Jan-21,0.1,,
2748,Flare Community Approves DOGE,24-Jan-21,0.1,,
2749,"Puff Bar Implements Vechain, ETH, and BCH",24-Jan-21,0.1,,
2750,AAVE Hits New All Time High Price,24-Jan-21,0.8,,
2751,,24-Jan-21,0.7,ETH Mining Difficulty and Google Searches Reach ATH,ETH Mining Difficulty and Google Searches Reach ATH
2752,,24-Jan-21,0.1,SEC and CFTC See Crypto Literate Heads Chosen,SEC and CFTC See Crypto Literate Heads Chosen
2753,,24-Jan-21,0.5,ALPHA hits $1 as Homora v2 Launch Nears,ALPHA hits $1 as Homora v2 Launch Nears
2754,,23-Jan-21,0.1,Valkyrie Fund Files to Register New Bitcoin ETF with SEC,Valkyrie Fund Files to Register New Bitcoin ETF with SEC
2755,,23-Jan-21,0.4,Chainlink Hits Trifecta with SKALE Integration,Chainlink Hits Trifecta with SKALE Integration
2756,,23-Jan-21,0.1,ECB Sees Digital Euro as Useful for ‘All Citizens’,ECB Sees Digital Euro as Useful for ‘All Citizens’
2757,,23-Jan-21,0.3,Michael Saylor: BTC Price Will Replace S&P 500,Michael Saylor: BTC Price Will Replace S&P 500
2758,,23-Jan-21,0.6,Polkadot Ecosystem Gains $10 Million VC Fund Amid Activity,Polkadot Ecosystem Gains $10 Million VC Fund Amid Activity
2759,,23-Jan-21,0.9,"BNB Reclaims Breakout Level, Targets New All-Time High","BNB Reclaims Breakout Level, Targets New All-Time High"
2760,,22-Jan-21,0.0,"BeInCrypto Weekly News Roundup: January 22, 2021","BeInCrypto Weekly News Roundup: January 22, 2021"
2761,,22-Jan-21,0.1,5 DeFi-Related Projects to Watch During Alt Season,5 DeFi-Related Projects to Watch During Alt Season
2762,,22-Jan-21,0.3,OKCoin Exchange to Add Lightning Network Payments,OKCoin Exchange to Add Lightning Network Payments
2763,,22-Jan-21,0.4,IOTA Foundation Secures Multiple Smart City Partnerships in Asia,IOTA Foundation Secures Multiple Smart City Partnerships in Asia
2764,,22-Jan-21,0.6,"MicroStrategy Piles into Bitcoin, Scooping Up Another $10 Million","MicroStrategy Piles into Bitcoin, Scooping Up Another $10 Million"
2765,,22-Jan-21,0.8,DOT and the DeFi Index Rally Towards New Highs,DOT and the DeFi Index Rally Towards New Highs
2766,,22-Jan-21,0.2,Demand for Bitcoin Miners Pressures Chip Makers Amid Global Shortage,Demand for Bitcoin Miners Pressures Chip Makers Amid Global Shortage
2767,,22-Jan-21,0.4,Bitcoin Social Volume Spike Could Signal Incoming Euphoria,Bitcoin Social Volume Spike Could Signal Incoming Euphoria
2768,,22-Jan-21,0.3,Bitcoin Subreddit Surpasses Two Million Member Milestone,Bitcoin Subreddit Surpasses Two Million Member Milestone
2769,,22-Jan-21,0.2,Kyber Network Readies Massive DeFi Protocol Overhaul,Kyber Network Readies Massive DeFi Protocol Overhaul
2770,,22-Jan-21,0.8,Alpha Finance (ALPHA) Climbs to All-Time High — Targetting $1,Alpha Finance (ALPHA) Climbs to All-Time High — Targetting $1
2771,,22-Jan-21,0.3,Aave Crosses into DeFi Layer-2 with Matic Bridge,Aave Crosses into DeFi Layer-2 with Matic Bridge
2772,,22-Jan-21,-0.4,"Bitcoin Briefly Drops Below $30,000 Before Reclaiming","Bitcoin Briefly Drops Below $30,000 Before Reclaiming"
2773,,22-Jan-21,-0.5,Bitcoin Dominance Plummets while Altcoins Outperform,Bitcoin Dominance Plummets while Altcoins Outperform
2774,,22-Jan-21,0.5,Russian Court Removes Binance from Domain Blacklist,Russian Court Removes Binance from Domain Blacklist
2775,,21-Jan-21,0.4,XRP Outperforms BTC by 5% Following Biden Appointment,XRP Outperforms BTC by 5% Following Biden Appointment
2776,,21-Jan-21,0.3,Sequoia Offers Employees Partial Salary in Bitcoin,Sequoia Offers Employees Partial Salary in Bitcoin
2777,,21-Jan-21,0.1,Grayscale May Have a Secret Chainlink Trust,Grayscale May Have a Secret Chainlink Trust
2778,,21-Jan-21,0.2,Stellar and Wirex Research Shows a Growing Need for Cryptocurrency,Stellar and Wirex Research Shows a Growing Need for Cryptocurrency
2779,,21-Jan-21,0.0,BiC’s Video News Show – Is President Biden Good for Crypto?,BiC’s Video News Show – Is President Biden Good for Crypto?
