index,Headline,Date,pred_score,Headline_x,Headline_y
886,"The Magnificent Seven: SHIB, REV, MATIC, AR, HT, YFI, AAVE — Biggest Gainers, May 7—14",14-May-21,0.1,,
887,Digivault Gets FCA Approval to Become First Stand-Alone Custodian Wallet,14-May-21,0.6,,
888,XMR Reaches New ATH Capping Lengthy Period of Positive Developments,14-May-21,0.8,,
889,Chia Launches Energy-Efficient Token – Here Is How It Works,14-May-21,0.4,,
890,"Square Curbs Plans to Buy More BTC, After Losing $20M on Its BTC Investment",14-May-21,-0.5,,
891,"The Hateful Eight: QTUM, BTT, ETC, HOT, NEO, OMG, ZRX, VET — Biggest Losers, May 7—14",14-May-21,-0.1,,
892,"Pantera Remains Bullish on BTC Despite Environmental, Criminal Concerns",14-May-21,0.3,,
893,"‘We Like Partnering With Regulators,’ Says Coinbase CFO",14-May-21,0.4,,
894,Indian Central Bank Urging Lenders to Cut Ties With Crypto Exchanges,14-May-21,-0.8,,
895,21% of Bitcoins From Bitfinex Hack Have Been Transferred,14-May-21,-0.3,,
896,Samsung Galaxy Devices Will Support Blockchain Hardware Wallets,14-May-21,0.4,,
897,Coinbase Stock Falls Amid Mixed Financial Results,14-May-21,-0.5,,
898,What Changed in Crypto Markets While You Were Sleeping — May 14,14-May-21,0.0,,
899,$5M Crypto Ransom Paid to Hackers to Restart Colonial Pipeline,14-May-21,-0.6,,
900,Bitcoin (BTC) Halts Decrease With Bounce Above Support,14-May-21,0.2,,
901,Brave Teams with Unstoppable Domains Making .Crypto Websites Available,14-May-21,0.5,,
902,Coinbase Releases Second Transparency Report for 2020,14-May-21,0.1,,
903,IRS Reveals Plans to Seize Crypto Held by Tax Dodgers,14-May-21,-0.7,,
904,BIC’s Video News Show: Bitcoin Cash,13-May-21,0.1,,
905,"Gold, Stocks, and Bitcoin: Weekly Overview, May 13",13-May-21,0.1,,
906,Exchange Tokens Regain Footing After Sharp Drop,13-May-21,0.3,,
907,IRS & DOJ Set Sights on Binance to Root Out Illicit Activity,13-May-21,-0.6,,
908,Grayscale Files Registration Statement With SEC for $GDLC,13-May-21,0.1,,
909,NANO Reaches New Highs Despite Market Correction,13-May-21,0.8,,
910,"‘That’s Going to Be Phenomenal,’ Shark Tank’s Kevin O’Leary on NFTs",13-May-21,0.6,,
911,MicroStrategy Buys Another 271 BTC for $15 Million,13-May-21,0.4,,
912,Will TRX Increase After Inclusion in PancakeSwap Pool?,13-May-21,0.1,,
913,These 10 Cryptos Could Soon Be Delisted from Binance,04-Jan-24,-0.5,,
914,"Chainlink (LINK) in 2024: Price Dips Now, But Analysts Forecast Major Upswing",04-Jan-24,0.1,,
915,"2023 Security Woes: Web3 Loses $1.8B to Criminals, but Are Lessons Being Learned?",04-Jan-24,-0.4,,
916,Solana (SOL) Price Dips Below $100 – Should Bulls Be Concerned?,04-Jan-24,-0.3,,
917,"Shiba Inu (SHIB) vs FLOKI: Burn Rate Battle With SHIB up 300%, FLOKI 600%",04-Jan-24,0.1,,
918,DeFi Protocol Gamma Loses $4 Million in Price Manipulation Exploit,04-Jan-24,-0.8,,
919,Why Did Dogecoin (DOGE) Tumble by 15%? Analyzing Yesterday’s Price Movement,04-Jan-24,-0.5,,
920,"Fed Signals Interest Rate Peak, Doesn’t Rule Out Future Hikes ",04-Jan-24,0.1,,
921,South Korean Watchdog Seeks to Forbid Buying Crypto with Credit Cards,04-Jan-24,-0.6,,
922,"$100B Crypto Market Washout Was Normal Activity, Say Analysts ",04-Jan-24,-0.3,,
923,"ENS Defies Crypto Market Dump, Spiking 55% on Vitalik Endorsement",04-Jan-24,0.8,,
924,UK Online Safety Act Falls Short Against Advanced Generative AI: Report,04-Jan-24,-0.3,,
925,Bitcoin ETF Filings Trigger Rising Levels of Confusion,03-Jan-24,-0.2,,
926,Institutions Double Down on Bitcoin Price Predictions for 2024 Despite Recent Volatility,03-Jan-24,0.4,,
927,These 3 Narratives Could Drive Crypto in 2024: 15 Altcoins to Watch,03-Jan-24,0.1,,
928,Ripple (XRP) Price Returns to Pivotal Support – Will It Sink or Swim?,03-Jan-24,-0.1,,
929,On-Chain Analysis: Bitcoin (BTC) Drops to Reset Bull Market Indicators,13-May-21,-0.2,,
930,CipherTrace Reports Decrease in Crypto Crime Since Beginning of the Year,13-May-21,0.5,,
931,Cardano (ADA) Hits Its Highest Value of All Time,13-May-21,0.9,,
932,"Sotheby’s Closes $12.9M Banksy Auction, First Paid in Crypto",13-May-21,0.4,,
933,BTC On-Chain Analysis: HODL Waves Show Medium-Term Sellers,13-May-21,-0.2,,
934,Crypto Community Reacts to Tesla Dropping Bitcoin Payments,13-May-21,-0.6,,
935,"BTC, ETH, XRP, AVA, CHZ, XMR, DGB—Technical Analysis May 13",13-May-21,0.1,,
936,Microsoft Shuttering Azure Blockchain Services,13-May-21,-0.4,,
937,Facebook Diem Association to Move from Switzerland to US,13-May-21,0.1,,
938,Cardano Prepares to Launch Alonzo Testnet — Here Is What to Expect,13-May-21,0.3,,
939,What Changed in Crypto Markets While You Were Sleeping — May 13,13-May-21,0.1,,
940,Bitcoin Drops Sharply after Tesla Suspends BTC Payments,13-May-21,-0.8,,
941,"Musk Puts Bitcoin on Pause, Tesla Suspends BTC Payments",13-May-21,-0.7,,
942,BIC’s Video News Show: Shiba Inu (SHIB),12-May-21,0.1,,
943,Figure Securities Becomes SEC-Registered Alternative Trading System,12-May-21,0.1,,
944,ETH Reaches Yet Another All-Time High —What’s Next?,12-May-21,0.8,,
945,Hungary Hopes Tax Slash Will Incentivize Investors to Declare Crypto Earnings,12-May-21,0.3,,
946,"BTC, XRP, ETH, SXP, ZEC, BAND, ROSE —Technical Analysis, May 12",12-May-21,0.1,,
947,Tor’s Upcoming NFT Auction to Let Bidders Own Piece of History,12-May-21,0.3,,
948,"YFI Leads the Way for DeFi Coins, COTI And Alpha Could Soon Follow",12-May-21,0.4,,
949,US SEC Warns Against Investment in BTC Futures Market,12-May-21,-0.5,,
950,Crypto Media Companies Boom as Searches and Adoption Surge,12-May-21,0.6,,
951,Crypto.com Gains Class 3 VFA License From Maltese Financial Authorities,12-May-21,0.5,,
952,"More Crypto Point-of-Sales Through MoneyGram, Coinme Partnership",12-May-21,0.3,,
953,"Coinbase, Softbank Boost Funding of Brazil-Based Money Management Firm",12-May-21,0.4,,
954,Kinguin Launches Gamer NFT Platform with Immutable X,12-May-21,0.2,,
955,Internet Computer (ICP) Market Value Reaches $45B Two Days after Launch,12-May-21,0.6,,
956,Bitcoin Dominance (BTCD) Drops to Lowest Levels Since 2018,12-May-21,-0.3,,
957,Christie’s Auctions Nine Rare CryptoPunk NFTs for Nearly $17M,12-May-21,0.7,,
958,"Ethereum Market Cap Reaches New Highs, Surpasses Visa",12-May-21,0.8,,
959,What Changed in Crypto Markets While You Were Sleeping — May 12,12-May-21,0.1,,
960,Vitalik Buterin: UNI Should Become an Oracle Token,12-May-21,0.2,,
961,Bitcoin (BTC) Bounces in Attempt to Resume Bullish Trend,12-May-21,0.4,,
962,BitMEX Money Laundering Trial to Begin in March 2022,12-May-21,-0.7,,
963,YFI Pumps to $95K Following Yearn Woofy Dog Meme Token,12-May-21,0.3,,
964,Balancer Labs Releases V2 AMM to Reduce Gas Fees for DeFi Traders,11-May-21,0.5,,
965,"Palantir Reveals First Quarter Results, Starts Accepting Bitcoin",11-May-21,0.6,,
966,Polkadot Incorporates PARSIQ to Create Complex Automation and Workflows,11-May-21,0.3,,
967,TaxBit to Help IRS Ensure Crypto Traders Report on Taxes Properly,11-May-21,-0.2,,
968,Block.one Launches Bullish Cryptocurrency Exchange,11-May-21,0.6,,
969,Israel’s Central Bank Announces Plans for Digital Shekel,11-May-21,0.2,,
970,"Bitcoin (BTC) Drops 10%, Finds Support at $53,500",11-May-21,-0.4,,
971,Merriam-Webster Dictionary to Auction the Definition of NFT,11-May-21,0.3,,
972,Dogecoin Jumps From Tesla Payment Option Query,11-May-21,0.5,,
973,FTX Trading Volume Surpassed $400 Billion in April,11-May-21,0.6,,
974,Thai Asset Management Firm Bets Big on DeFi and dApps,11-May-21,0.4,,
975,Indonesia Mulls Tax on Crypto Trading,11-May-21,-0.3,,
976,Dogecoin Holders Duped During Musk’s SNL Performance,11-May-21,-0.6,,
977,"JPMorgan Analysts: Ethereum Should Be Trading at $1,000",11-May-21,0.7,,
978,XRP Historical Yearly Price Movement Overview,11-May-21,0.1,,
979,What Changed in Crypto Markets While You Were Sleeping — May 11,11-May-21,0.1,,
980,Bitcoin ETF Delays Expected as SEC Investigates Investor Protection,11-May-21,-0.4,,
981,Ethereum Migration from CeFi to DeFi Accelerates,11-May-21,0.3,,
982,Cathie Wood Joins Board of European Crypto Platform Amun Holdings,11-May-21,0.4,,
983,Drops DeFi NFT Platform IDO to Launch on Polkastarter,11-May-21,0.2,,
984,"Greenidge Expands Mining Operations, Raises Environmental Concerns",10-May-21,-0.5,,
985,Crypto Miner Hive Unloads Norwegian Data Center After Loss of Power Subsidy,10-May-21,-0.3,,
986,ParaSwap on Polygon Generates $37.4M in Volume Over 24-Hour Period,10-May-21,0.4,,
987,Kava Labs Reveals First Production-Ready Cross-Chain Liquidity Hub for DeFi,10-May-21,0.5,,
988,Swiss-Based UBS Plans Digital Currency Offerings to Wealthy Clients,10-May-21,0.3,,
989,Canadian Investment Fund Offsetting Carbon Footprint With Crypto ETF Fees,10-May-21,0.6,,
990,Morgan Creek CEO: Bitcoin Could Reach $250K Chasing After Gold,10-May-21,0.7,,
991,Alpha Finance Lab Launches New Oracle Aggregator,10-May-21,0.3,,
992,NYC Comptroller Candidate Suggests Crypto Investments as Inflation Hedge,10-May-21,0.2,,
993,Litecoin (LTC) Historical Yearly Price Movement Overview,10-May-21,0.1,,
994,"Dogecoin Goes Lunar, Funding SpaceX Moon Mission",10-May-21,0.7,,
995,What Changed in Crypto Markets While You Were Sleeping — May 10,10-May-21,0.1,,
996,South Korean Company Crypto Holdings Pass 10 Billion Won,10-May-21,0.4,,
997,Alipay Testing Digital RMB Payment Feature in Preliminary Trial,10-May-21,0.2,,
998,"Ethereum Price Surges to New All-Time High Above $4,100",10-May-21,0.8,,
999,Rari Capital Details $10M DeFi Hack in Post Mortem,10-May-21,-0.7,,
1000,"Top Three Weekend Gainers: ARRR, MATIC, and TEL",09-May-21,0.3,,
1001,,09-May-21,-0.5,DOGE Leads Liquidations with $280 million in Last 12 Hours,DOGE Leads Liquidations with $280 million in Last 12 Hours
1002,,09-May-21,0.6,Gary Vaynerchuk Backs NFTs – ‘the Overall Movement Is Here to Stay’,Gary Vaynerchuk Backs NFTs – ‘the Overall Movement Is Here to Stay’
1003,,09-May-21,0.1,‘Time to Switch to Satoshis’ says Novogratz,‘Time to Switch to Satoshis’ says Novogratz
1004,,09-May-21,0.9,ADA Leapfrogs USDT as New All Time High Reaches $1.78,ADA Leapfrogs USDT as New All Time High Reaches $1.78
1005,,09-May-21,-0.8,Sharp Plummet for DOGE Following Musk Saturday Night Live Appearance,Sharp Plummet for DOGE Following Musk Saturday Night Live Appearance
1006,,08-May-21,-0.3,Elon Musk Advises Caution for Cryptocurrency Investors,Elon Musk Advises Caution for Cryptocurrency Investors
1007,,08-May-21,0.9,"Bullish ETH Sets New All-Time High as It Touches $3,800","Bullish ETH Sets New All-Time High as It Touches $3,800"
1008,,08-May-21,0.8,Cardano (ADA) Breaks out After Consolidation to hit All-Time High at $1.70,Cardano (ADA) Breaks out After Consolidation to hit All-Time High at $1.70
1009,,08-May-21,0.4,Italian Football League Becomes Crypto.com’s Latest Sporting Partnership,Italian Football League Becomes Crypto.com’s Latest Sporting Partnership
1010,,08-May-21,0.3,Bitpanda to Expand Institutional Offerings with Announced Series-B Extension,Bitpanda to Expand Institutional Offerings with Announced Series-B Extension
1011,,08-May-21,-0.2,Exploring the Complicated Relationship Between SEC and Crypto,Exploring the Complicated Relationship Between SEC and Crypto
1012,,08-May-21,0.1,Measuring the Yearly Increase for ETH,Measuring the Yearly Increase for ETH
1013,,08-May-21,-0.6,Ripple Compelled to Produce Evidence of Legal Advice about XRP Sales,Ripple Compelled to Produce Evidence of Legal Advice about XRP Sales
1014,,08-May-21,0.2,Icecap Relocates to Dubai and Launches NFT Diamond Collection,Icecap Relocates to Dubai and Launches NFT Diamond Collection
1015,,08-May-21,0.8,Latest ATH for Dogecoin Ahead of Musk SNL Appearance,Latest ATH for Dogecoin Ahead of Musk SNL Appearance
1016,,08-May-21,-0.4,"12,354 BTC Withdrawn From Coinbase in an Hour, Totaling $700M","12,354 BTC Withdrawn From Coinbase in an Hour, Totaling $700M"
1017,,08-May-21,0.5,VanEck Submits SEC Filing to Create an ETH-Centered ETF,VanEck Submits SEC Filing to Create an ETH-Centered ETF
1018,,07-May-21,-0.3,SEC Chairman Says Crypto Markets Need Regulations to Prevent Fraud,SEC Chairman Says Crypto Markets Need Regulations to Prevent Fraud
1019,,07-May-21,0.7,"The Magnificent Seven: TEL, ETC, QTUM, DOGE, OMG, EOS, LSK — Biggest Gainers, April 30 – May 7","The Magnificent Seven: TEL, ETC, QTUM, DOGE, OMG, EOS, LSK — Biggest Gainers, April 30 – May 7"
1020,,07-May-21,0.5,"Digital Currencies to Be Part of the Future, Says CEO of Rockefeller Capital Management","Digital Currencies to Be Part of the Future, Says CEO of Rockefeller Capital Management"
1021,,07-May-21,0.6,"Dogecoin Craze Outpacing Other Coins, Even Companies","Dogecoin Craze Outpacing Other Coins, Even Companies"
1022,,07-May-21,-0.4,Chips Shortage May Be Exacerbated by Mining Giant Bitmain Order,Chips Shortage May Be Exacerbated by Mining Giant Bitmain Order
1023,,07-May-21,-0.7,"The Hateful Eight: CAKE, MATIC, CHZ, ENJ, RSR, KLAY, KCS, STX – Biggest Losers, April 30 – May 7","The Hateful Eight: CAKE, MATIC, CHZ, ENJ, RSR, KLAY, KCS, STX – Biggest Losers, April 30 – May 7"
1024,,07-May-21,0.3,NFTs Disrupt Sports World — What This Means for Athletes,NFTs Disrupt Sports World — What This Means for Athletes
1025,,07-May-21,0.2,"Community Driving the Value of Coins, Says Paxos CEO","Community Driving the Value of Coins, Says Paxos CEO"
1026,,07-May-21,0.4,"ATOM Completes Correction, Expected to Keep Going Up","ATOM Completes Correction, Expected to Keep Going Up"
1027,,07-May-21,0.3,Ripple Highlights Growing ODL Demand in Markets Report,Ripple Highlights Growing ODL Demand in Markets Report
1028,,07-May-21,0.6,"THETA, BZRX, OCEAN Reclaim Key Levels, Aim for New Highs","THETA, BZRX, OCEAN Reclaim Key Levels, Aim for New Highs"
1029,,07-May-21,0.4,Open DeFi Unveils Multi-Chain DAO for Decentralized Finance Sector,Open DeFi Unveils Multi-Chain DAO for Decentralized Finance Sector
1030,,07-May-21,0.3,Citigroup Weighing Crypto Market Entry Amid Client Demand,Citigroup Weighing Crypto Market Entry Amid Client Demand
1031,,07-May-21,0.4,SEC Chairman Working Towards Crypto Investor Protection,SEC Chairman Working Towards Crypto Investor Protection
1032,,07-May-21,0.0,What Changed in Crypto Markets While You Were Sleeping — May 7,What Changed in Crypto Markets While You Were Sleeping — May 7
1033,,07-May-21,0.8,Cash App Bitcoin Revenue up 11x — Square Report,Cash App Bitcoin Revenue up 11x — Square Report
1034,,07-May-21,0.2,"Bitcoin (BTC) Regains Footing After Rejection from $58,000","Bitcoin (BTC) Regains Footing After Rejection from $58,000"
1035,,07-May-21,0.5,Binance Rolls Out Terra Virtua (TVK) High-Yield Staking,Binance Rolls Out Terra Virtua (TVK) High-Yield Staking
1036,,07-May-21,0.7,Yearn Finance Boasts Record Revenues in April,Yearn Finance Boasts Record Revenues in April
1037,,06-May-21,0.1,BIC’s Video News Show: Solana Review,BIC’s Video News Show: Solana Review
1038,,06-May-21,0.5,"1INCH, ICX, YFI Complete Corrections and Aim for New Highs","1INCH, ICX, YFI Complete Corrections and Aim for New Highs"
1039,,06-May-21,0.1,"Gold, Stocks, Bitcoin: Weekly Overview — May 6","Gold, Stocks, Bitcoin: Weekly Overview — May 6"
1040,,06-May-21,0.4,Vorto Gaming Gets NEAR Support to Develop Blockchain Gaming Platform,Vorto Gaming Gets NEAR Support to Develop Blockchain Gaming Platform
1041,,06-May-21,0.9,"ETH Reaches New All-Time High, Technical Indicators Still Bullish","ETH Reaches New All-Time High, Technical Indicators Still Bullish"
1042,,06-May-21,0.7,BCH Finally Breaks Out From Long-Term Resistance,BCH Finally Breaks Out From Long-Term Resistance
1043,,06-May-21,-0.4,US Court Issues Summons to Kraken for Information on Taxpayers,US Court Issues Summons to Kraken for Information on Taxpayers
1044,,06-May-21,0.6,PayPal Earnings Boosted by ‘Crypto Efforts’,PayPal Earnings Boosted by ‘Crypto Efforts’
1045,,06-May-21,0.9,ADA Reaches All Time High as Bullish Run Continues,ADA Reaches All Time High as Bullish Run Continues
1046,,06-May-21,0.3,BTC On-Chain Analysis: SSR Shows Increased Buying Power for Stablecoins,BTC On-Chain Analysis: SSR Shows Increased Buying Power for Stablecoins
1047,,06-May-21,0.3,ING Report Advocates Best of Both Worlds Approach to DeFi Integration,ING Report Advocates Best of Both Worlds Approach to DeFi Integration
1048,,06-May-21,0.1,"BTC, ETH, XRP, TRX, EOS, XVG, SUSHI—Technical Analysis May 6","BTC, ETH, XRP, TRX, EOS, XVG, SUSHI—Technical Analysis May 6"
1049,,06-May-21,-0.8,Dogecoin Demand Crashes India’s Largest Crypto Exchange,Dogecoin Demand Crashes India’s Largest Crypto Exchange
1050,,06-May-21,0.2,Georgia’s Central Bank Mulls CBDC Launch,Georgia’s Central Bank Mulls CBDC Launch
1051,What Changed in Crypto Markets While You Were Sleeping — May 6,06-May-21,0.0,,
1052,Bitcoin (BTC) Signals Bullish Trend with Strong Bounce,06-May-21,0.5,,
1053,Coinbase to Shutter San Francisco HQ and Go Remote,06-May-21,-0.2,,
1054,Uniswap v3 Became a ‘Uniflop’ on Opening Day,06-May-21,-0.6,,
1055,"Crypto Markets See Record-Setting Week, ETH Enjoys New Highs",06-May-21,0.8,,
1056,NFT Social Network Showtime Raises $7.8 Million,06-May-21,0.3,,
1057,Grayscale Becomes First Crypto Sponsor of NFL Team with Giants’ Team-Up,05-May-21,0.3,,
1058,"Crypto Market Valuation to Surpass $1.8B by 2027, Report",05-May-21,0.4,,
1059,New BTC Indicator Launches to Understand Crypto Media Sentiment,05-May-21,0.1,,
1060,ZIL Bounces and Aims for New All-Time High Price,05-May-21,0.6,,
1061,Bitcoin Coming to Bank Near You Thanks to NYDIG and FIS,05-May-21,0.3,,
1062,BSC Coins Show Strength as BNB Reaches $100B Capitalization,05-May-21,0.5,,
1063,Bitso’s Latest Funding Round Makes It Latin America’s First Crypto Unicorn,05-May-21,0.7,,
1064,"Gary Vaynerchuk Announces His First NFT Collection, VeeFriends",05-May-21,0.1,,
1065,LINK Breaks Out and Attains New All-Time High,05-May-21,0.6,,
1066,Satellite-Based NFT Ecosystem Launches on SpaceX Falcon 9 Rocket,05-May-21,0.2,,
1067,Australian Elite Get on Crypto Train as Digital Assets Go Mainstream,05-May-21,0.3,,
1068,New Compute North CTO to Drive Next Phase of Crypto Mining Solutions,05-May-21,0.2,,
1069,Galaxy Digital Holdings Scores $1.2B BitGo Acquisition,05-May-21,0.7,,
1070,Carole Baskin Turns to Crypto After Inflation Concerns,05-May-21,0.1,,
1071,"BTC, XRP, ETH, AVAX, NEO, DIA, KAVA—Technical Analysis May 5",05-May-21,0.0,,
1072,What Changed in Crypto Markets While You Were Sleeping — May 5,05-May-21,0.0,,
1073,Formation Fi DeFi Protocol Raises $3.3M for Smart Yield Farming,05-May-21,0.4,,
1074,"Bitcoin (BTC) Finds Support Near $53,000 and Bounces",05-May-21,0.3,,
1075,Crypto Mining Hardware Market Anticipates $2.8B Growth by 2024,05-May-21,0.4,,
1076,Coinbase Lists Tether (USDT) Following Pro Version Support,05-May-21,0.2,,
1077,$100M DeFi Venture Fund Announced by Multicoin Capital,05-May-21,0.3,,
1078,Ethereum Price Highs Triggered $55M in Short Liquidations,05-May-21,-0.3,,
1079,WallStreetBets Launches Blockchain App to Fight Market Manipulation,04-May-21,0.2,,
1080,Virtual Fashion Platform Secures $8M From Andreessen Horowitz and Others,04-May-21,0.4,,
1081,BIC’s Video News Show: 5 NFT Altcoins for May 2021,04-May-21,0.1,,
1082,Oakland Athletics Begin Selling MLB Game Tickets Priced in DOGE,04-May-21,0.3,,
1083,"XTZ Aims for New Highs, After Reclaiming Crucial Level",04-May-21,0.5,,
1084,Market for NFTs Levels Off After Hectic First Quarter,04-May-21,-0.1,,
1085,Former US Treasurer Joins Ripple’s Board Amidst Legal Battle With SEC,04-May-21,0.1,,
1086,"S&P Launches Digital Market Indices Based on Bitcoin, Ethereum",04-May-21,0.3,,
1087,"DOGE Reaches New ATH, Robinhood Crashes During Coin’s Surge",04-May-21,0.7,,
1088,StarColl Celebrates Star Wars Day With NFT Collection,04-May-21,0.2,,
1089,These Are the Top Crypto Gamechangers to Watch in 2024 – Messari,03-Jan-24,0.1,,
1090,Shiba Inu (SHIB) Price Could Fall 20% if This Pattern Holds,03-Jan-24,-0.5,,
1091,Why $500 Million in Cryptos Were Liquidated Within 1 Hour,03-Jan-24,-0.6,,
1092,"Hackers Target Solana (SOL) Amid Boom in Memecoins, NFTs, and Airdrops",03-Jan-24,-0.7,,
1093,Ethereum (ETH) Sees Major Supply Shift to Exchanges by Institutions,03-Jan-24,0.3,,
1094,"SEC Will Reject All Bitcoin Spot ETFs, Expect BTC Price Dip",03-Jan-24,-0.8,,
1095,Here’s Why the Internet Computer (ICP) Price Increased by 150% in 20 Days,03-Jan-24,0.6,,
1096,How the Rivalry for Spot Bitcoin ETF Approval Has Intensified,03-Jan-24,0.1,,
1097,Polygon (MATIC) Breaks Long-Term Resistance – Will the Rally Gain Momentum?,03-Jan-24,0.4,,
1098,Crypto Investors Lose Millions Through Known Fault on DeFi Protocol Radiant Capital,03-Jan-24,-0.8,,
1099,OKX Puts Users to the Test to Comply With New UK Crypto Regulation,03-Jan-24,-0.1,,
1100,"‘You Can’t Kill Bitcoin,’ Jim Cramer Flips Bullish on Crypto (Again) ",03-Jan-24,0.5,,
1101,Michael Saylor and Coinbase Insiders Are Selling Stock: Is a Crypto Correction Imminent?,03-Jan-24,-0.3,,
1102,Why Strike CEO Jack Mallers Went All-In With Bitcoin,03-Jan-24,0.1,,
1103,New Crypto Tax Duty Demands Vigilance from US Citizens,02-Jan-24,-0.2,,
1104,Investors Forecast 88% Probability to SEC Approving Spot Bitcoin ETF,02-Jan-24,0.7,,
1105,BNB Becomes Third Crypto With Valuation Above $100 Billion,04-May-21,0.8,,
1106,Uniswap V3 Arrival Signals Bright Future For the DEX,04-May-21,0.5,,
1107,Polkadot-Based Equilibrium Raises $8.5M in DOT With PLO Drive,04-May-21,0.6,,
1108,"BTC, ETH On-Chain Analysis: NVT Ratio Supports Market Growth",04-May-21,0.4,,
1109,"CBDCs Will Lack ‘Key Properties’ of Cryptocurrencies, Says CZ",04-May-21,-0.1,,
1110,Cryptopunks Developer Larva Labs Launches New NFT Project,04-May-21,0.2,,
1111,"BTC, ETH, XRP, WAVES, SXP, DOGE, ZEN —Technical Analysis for May 4",04-May-21,0.1,,
1112,"Consumer Interest in Crypto Payments Grows, Says Mastercard Survey",04-May-21,0.4,,
1113,MakerDAO Offers MKR Fund Returns to Bolster Decentralization,04-May-21,0.3,,
1114,New OCC Head Could Influence US Crypto Regulations,04-May-21,0.1,,
1115,What Changed in Crypto Markets While You Were Sleeping — May 4,04-May-21,0.1,,
1116,New Thailand Crypto Regulations Force In-Person KYC,04-May-21,-0.3,,
1117,Bitcoin (BTC) Attempts to Create Higher Low After Rejection,04-May-21,0.2,,
1118,EU-Based Bitstamp Crypto Exchange Officially Expands to US,04-May-21,0.5,,
1119,Ethereum Throughput Skyrockets After Gas Limit Adjustment,04-May-21,0.6,,
1120,DCG Green Lights $750M Grayscale Bitcoin Trust Purchase,04-May-21,0.7,,
1121,Social Investing App Invstr Launches Crypto Trading Through Coinbase,03-May-21,0.5,,
1122,Genies Snags $65M to Develop Virtual Portable Identities,03-May-21,0.3,,
1123,Bitcoin Depot Launches More Than 350 New Crypto ATMs in US,03-May-21,0.4,,
1124,These Top-10 Coins Could Be on Verge of Breaking Out,03-May-21,0.3,,
1125,Partnerships With Traditional Finance Provide More Use Cases for Crypto,03-May-21,0.4,,
1126,Crypto Bank SEBA Now Supports DeFi Tokens,03-May-21,0.3,,
1127,DeFi Index Reaches New ATH — Will DOT Follow Suit?,03-May-21,0.5,,
1128,eBay Looking Into Crypto Payment Option,03-May-21,0.3,,
1129,WisdomTree Expands Its Digital Assets Range With ETH ETP,03-May-21,0.4,,
1130,CME Group Launches Micro Bitcoin Futures to Attract Retail Traders,03-May-21,0.4,,
1131,Digital Dollar Project Launches 5 Pilots to Measure Value of US CBDC,03-May-21,0.1,,
1132,Where did the Thodex Crypto Exchange Bitcoins Go?,03-May-21,-0.7,,
1133,Five Biggest Altcoin Gainer Showcase: April 26 – May 3,03-May-21,0.5,,
1134,Dogecoin Now Valued Higher than Twitter and Ford,03-May-21,0.7,,
1135,Altcoin Season Rages as Bitcoin Dominance (BTCD) Slides,03-May-21,-0.2,,
1136,MakerDAO April Financial Report: Net Income Crosses $12 Million,03-May-21,0.6,,
1137,What Changed in Crypto Markets While You Were Sleeping — May 3,03-May-21,0.1,,
1138,Crypto Capital Gains Tax in South Korea Sees Majority Support,03-May-21,0.1,,
1139,"Bitcoin (BTC) Rebounds, Indicators Signal Bullish Continuation",03-May-21,0.6,,
1140,"Ethereum Crosses $3,100 Making Vitalik Buterin a Young Billionaire",03-May-21,0.8,,
1141,Spartan DeFi Suffers $30M Loss in BSC Flash Loan Attack,03-May-21,-0.8,,
1142,Barry Silbert Looks Forward to Selling BTC at $100k to Berkshire Hathaway,02-May-21,-0.1,,
1143,BLES Announces Launchpad Enabling Tokenized Funding for NFT Creators,02-May-21,0.4,,
1144,Berkshire Hathaway Vice Chairman Charlie Munger ‘Hates’ Bitcoin’s Success,02-May-21,-0.5,,
1145,"Top 5 DeFi Coins for May — SXP, UNI, REN, ORN, SWAP",02-May-21,0.1,,
1146,Revolut Launches Bitcoin Withdrawals With More Tokens to Come,02-May-21,0.5,,
1147,Kurt Cobain’s Last Photoshoot Collection Goes up for Auction as an NFT,02-May-21,0.2,,
1148,Penthouse in the Netherlands Set to be Sold for 21 BTC,01-May-21,0.2,,
1149,"Tether Releases Consolidated Reserves Report, Backing $50B in Assets",01-May-21,0.3,,
1150,Özer Siblings Among Those Jailed as Thodex Fraud Probe Continues,01-May-21,-0.8,,
1151,"Alcohol Industry Is Embracing Crypto, From Payments to NFTs",01-May-21,0.1,,
1152,"ETH, BNB Both Set New All-Time Highs as BTC Dominance Declines",01-May-21,0.7,,
1153,"Top 10 Aspiring Coins for May — HBAR, LSK, ADA, NEO, BSV, REN, UNI, ANT, VGX, BLES",01-May-21,0.1,,
1154,Battle Of The Privacy Coins – Will ZEC Or DASH Perform Better In May?,01-May-21,0.1,,
1155,"On-Chain Analysis: NVT Model, Record Fees and Miners Accumulation",01-May-21,0.1,,
1156,Venture Capital Firm a16z Set to Launch $1 Billion Crypto Fund,01-May-21,0.6,,
1157,SEC to File Response to Ripple’s Individual Motions to Dismiss,01-May-21,-0.1,,
