index,Headline,Date,pred_score,Headline_x,Headline_y
1,UAE Pro League Teams Up With Chiliz to Bring Web3 for Fans,18-Apr-24,0.3,,
2,Polkadot Price Forecast: Will DOT Reach the $5 Level Soon?,18-Apr-24,0.1,,
3,Binance Opts for USDC Reserves While It Seeks India Return and Dubai Entry,18-Apr-24,0.2,,
4,Worldcoin Introduces World Chain Layer-2 Amidst Regulatory Spotlight,18-Apr-24,-0.1,,
5,"BlackRock Was Tipped Off About High Inflation, Uses Bitcoin to Hedge",18-Apr-24,0.4,,
6,"Is the Bitcoin, Crypto Bull Market Over? Analysts Weigh In",18-Apr-24,-0.3,,
7,Ripple (XRP) Price Analysis: 13% Recovery or 13% Decline – What Comes Next?,17-Apr-24,0.0,,
8,This Is How Nearly 1 Billion Polygon (MATIC) Will Witness Profits,17-Apr-24,0.7,,
9,Shiba Inu (SHIB) Price Forecast: Potential Bullish Bounce at Golden Ratio?,17-Apr-24,0.2,,
10,Will Pepe (PEPE) Price Mark a New All-Time High by the End of April?,17-Apr-24,0.1,,
11,BlackRock Targets Saudi Arabia After Successful Bitcoin ETF Launch,17-Apr-24,0.3,,
12,"Ethereum (ETH) Price Forecast: Has the Correction Ended, or Is Further Decline Expected?",17-Apr-24,-0.2,,
13,Beyond Gaming: Xai Expands to Staking Rewards,17-Apr-24,0.2,,
14,Here’s Why Toncoin (TON) May Drop Below $5 Amid Extended Investor Pessimism,17-Apr-24,-0.6,,
15,Goldman Sachs: Halving History May Not Predict Bitcoin’s Future,17-Apr-24,-0.1,,
16,Diamond Hands: 75% of Shiba Inu Holders Retain SHIB For Over 1 Year,17-Apr-24,0.4,,
17,91% of Coinbase’s Base Meme Coins at Risk: Vulnerabilities Exposed,08-Apr-24,-0.8,,
18,50% of Solana Presale Tokens Were Malicious: Research,08-Apr-24,-0.9,,
19,Ethena Labs’ USDe Increases Rewards to Users by 50%,08-Apr-24,0.5,,
20,On-Chain Metrics Suggest Shiba Inu (SHIB) Price Is Set to Soar by 42%,08-Apr-24,0.8,,
21,Bitcoin Miners Struggle to Maintain Operations Ahead of the Halving,08-Apr-24,-0.4,,
22,Ripple (XRP) Price Correction Looms as Institutions Pull Away,08-Apr-24,-0.5,,
23,Cardano (ADA) Breakout Signals: Brace for 32% Rally Ahead,08-Apr-24,0.7,,
24,NFT and Gaming Tokens to List on Top Exchanges: Sector Revival?,08-Apr-24,0.3,,
25,Dogecoin in the Danger Zone: How Bearish Reversal Could Slash Prices by 40%,08-Apr-24,-0.7,,
26,ParaSwap Hack Updates: DAO Approves Recovery Fund for Victims,08-Apr-24,-0.2,,
27,Why Charles Hoskinson is Bullish on These Two Cardano Upgrades,08-Apr-24,0.5,,
28,"Bitcoin (BTC) Breaks Key Resistance: $85,000 Next",08-Apr-24,0.8,,
29,Cryptocurrency Users Beware: Etherscan Ads May Drain Your Wallet,08-Apr-24,-0.7,,
30,Crypto Whales Buy $35 Million in Ethereum: Price Impact,08-Apr-24,0.6,,
31,"Base’s TVL Soars Past $4 Billion, Beating Out Arbitrum and Optimism Growth",08-Apr-24,0.8,,
32,Crypto vs. TradFi: Tether’s 2023 Earnings Rival World’s Largest Banks,08-Apr-24,0.4,,
33,Here’re the Top Trending Cryptocurrencies in the Past 24 Hours,09-Jan-24,0.1,,
34,What Will Happen If Bitcoin Price Reaches $1 Million,09-Jan-24,0.1,,
35,Will Solana (SOL) vs Ethereum (ETH) Network War be Decided by Developers?,09-Jan-24,-0.1,,
36,"Chainlink Scores New Partnerships, Sending Whales Into Buying Spree",09-Jan-24,0.6,,
37,Analyst Reveals Ripple’s Legal Challenges While XRP Ledger Faces DDOS Attack,09-Jan-24,-0.5,,
38,"Bitcoin (BTC) Rally Continues: Can It Reach $50,000 Before Possible ETF Decision This Week?",09-Jan-24,0.4,,
39,Andrew Tate May Recover Seized Bitcoin (BTC) From Romanian Authorities,09-Jan-24,0.1,,
40,Will Polygon (MATIC) Price Move Above $1 After New Upgrade?,09-Jan-24,0.2,,
41,GMT Sell-Off Underway? STEPN Unlocks 79.2 Million Tokens,09-Jan-24,-0.3,,
42,BONK Rallies Back: Overcoming a 65% Drop With a Strong Price Rebound,09-Jan-24,0.5,,
43,2024 Witnesses $151 Million Boom in Crypto Inflows Amid Bitcoin ETF Buzz,09-Jan-24,0.7,,
44,CFTC Urges Policymakers to Regulate DeFi,09-Jan-24,-0.2,,
45,Bitcoin (BTC) Reaches Extreme Greed Zone – Triggers $150M Short Squeeze,09-Jan-24,0.6,,
46,"Will Ripple (XRP) Price Dip Again, or Has the Uptrend Finally Begun?",09-Jan-24,0.0,,
47,Upbit Crypto Exchange Scores Digital Payment Token Services License From Singapore’s MAS,09-Jan-24,0.4,,
48,How ‘Undervalued’ Ethereum Could Become the Next Spot ETF Hype Wave,09-Jan-24,0.5,,
49,Point72 Asset Management Hiring Head of Crypto,01-Jul-21,0.2,,
50,"BTC, ETH, XRP, ZEC, COMP, MKR, ENJ — Technical Analysis July 1",01-Jul-21,0.1,,
51,Indian Crypto Exchanges Struggling With Payment Processors,01-Jul-21,-0.5,,
52,Top 10 Altcoin Performer Showcase For June 2021,01-Jul-21,0.6,,
53,What Changed in Crypto Markets While You Were Sleeping — July 1,01-Jul-21,0.1,,
54,FBI Bolstering Tactics Against Illicit Cryptocurrency Transactions and Cybercrimes,01-Jul-21,-0.7,,
55,Bitcoin (BTC) Resumes Dip Back to Support Levels,01-Jul-21,-0.4,,
56,FINRA Orders Robinhood to Pay Record $70 Million Fine,01-Jul-21,-0.9,,
57,Element DeFi Protocol Launches to Mainnet With High Fixed-Rate Yields,01-Jul-21,0.7,,
58,Bank of Russia Announces Upcoming Trial For Digital Ruble,30-Jun-21,0.3,,
59,World Wide Web Source Code NFT Sells at Sotheby’s For $5.43 million,30-Jun-21,0.2,,
60,Coinbase Unveils Plans to Launch a Cryptocurrency App Store,30-Jun-21,0.8,,
61,Galaxy VC Arm Taking Lead Investor Role in Virtual Real Estate Developer,30-Jun-21,0.6,,
62,Twitter Joins NFT Craze With ‘140 Collection’ of NFT’s,30-Jun-21,0.4,,
63,Women Are Finding Financial Freedom in Cryptocurrencies,30-Jun-21,0.5,,
64,Deal Could See 650 Banks Offer Bitcoin to 24 million Customers,30-Jun-21,0.8,,
65,Top-10 Aspiring Crypto Coins for July,30-Jun-21,0.1,,
66,Six Million Ethereum Now Being Staked on ETH 2.0,30-Jun-21,0.4,,
67,DeversiFi Debuting Token With Fair Launch Distribution Mechanism,30-Jun-21,0.3,,
68,BNY Mellon Investing Unit Remains Skeptical of Accepting Crypto,30-Jun-21,-0.3,,
69,"BTC, ETH, XRP, XMR, KAVA, ETC, WAVES — Technical Analysis June 30",30-Jun-21,0.1,,
70,What Changed in Crypto Markets While You Were Sleeping — June 30,30-Jun-21,0.1,,
71,Cream Finance DeFi Protocol to Launch on Polygon,30-Jun-21,0.4,,
72,Beijing Rail Transit Accepting Digital Renminbi Payments in Pilot Program,30-Jun-21,0.3,,
73,NatWest Imposes Daily Crypto Exchange Transaction Limits Over Fraud Concerns,30-Jun-21,-0.6,,
74,"Bitcoin (BTC) Bounces Back But Fails to Reclaim $36,000",30-Jun-21,-0.2,,
75,CoinMarketCap Launches Token Swaps and Uniswap Support,30-Jun-21,0.5,,
76,Multiple Hydropower Plants up For Sale in China as Crypto Miners Flee,29-Jun-21,-0.6,,
77,BTC China Exchange Shuts Down Amid Crackdowns,29-Jun-21,-0.8,,
78,BIC’s Video News Show: Top 5 Altcoins For July,29-Jun-21,0.1,,
79,Brazilian National Soccer and Bitci Team up to Release NFT Fan Tokens,29-Jun-21,0.5,,
80,Deutsche Börse Group Acquires Majority Stake in Crypto Finance AG,29-Jun-21,0.7,,
81,Crypto.com Becomes Global Crypto Partner of Formula 1,29-Jun-21,0.8,,
82,"Bitcoin (BTC) Attempts to Regain Key Support Area at $34,700",29-Jun-21,-0.2,,
83,Andreessen Horowitz Leads $12M Investment Round in Blockchain Analytics Platform Nansen,29-Jun-21,0.6,,
84,NFL Legend Tom Brady and Wife Gisele Bündchen Partner With FTX,29-Jun-21,0.8,,
85,Ark Invest Lending Name to Swiss Bitcoin ETF,29-Jun-21,0.6,,
86,More Crypto Asset Firms Withdrawing Application From UK Regulator,29-Jun-21,-0.4,,
87,What Changed in Crypto Markets While You Were Sleeping — June 29,29-Jun-21,0.1,,
88,Bitcoin-Targeted Cyber Attacks Surge by Nearly 200% in 2021,29-Jun-21,-0.7,,
89,"Morgan Stanley Holds 28,000 Grayscale Bitcoin Trust Shares, Valued Over $800,000",29-Jun-21,0.4,,
90,Mexican Authorities: Cryptocurrencies Can’t Be Used Within the Financial System,29-Jun-21,-0.5,,
91,Coinbase CEO: Our Goal Is to List Every Asset Where Legal,29-Jun-21,0.5,,
92,Compound Finance to Launch DeFi Treasury for Institutions,29-Jun-21,0.6,,
93,Controversial Bitcoin Blogger Mircea Popescu Drowns in Costa Rica,28-Jun-21,-0.9,,
94,Coinbase Gains Approval to Offer Crypto Custody Services in Germany,28-Jun-21,0.7,,
95,Hackers are Using Infected PC Games to Make Millions Mining Crypto,28-Jun-21,-0.8,,
96,Singapore Monetary Authority Announces Global CBDC Challenge,28-Jun-21,0.3,,
97,Cryptocurrency Becoming New Gold Among India’s Younger Investors,28-Jun-21,0.5,,
98,Polygon Launches New General-Purpose Blockchain Called Avail,28-Jun-21,0.4,,
99,The Digital Native Generation Is Coming to Crypto Through NFTs,28-Jun-21,0.4,,
100,Chinese Users Prohibited From Derivatives Trading on Huobi,28-Jun-21,-0.6,,
101,Robert Kiyosaki Backs Bitcoin as ‘Biggest Crash in World History is Coming’,28-Jun-21,-0.5,,
102,South African Central Bank Outlines FX Crypto Limits,28-Jun-21,-0.2,,
103,Mexican Billionaire Bullish on Banks Adopting Bitcoin,28-Jun-21,0.7,,
104,Binance Responds to UK Exchange Service Restrictions,28-Jun-21,-0.3,,
105,What Changed in Crypto Markets While You Were Sleeping — June 28,28-Jun-21,0.1,,
106,"DeFi Exploit Streak Hits Polygon, SafeDollar Crashes to Zero",28-Jun-21,-0.8,,
107,Digital Renminbi Tests to Kick Off in Hong Kong Next Year,28-Jun-21,0.2,,
108,ICON Balanced DeFi Protocol Votes For $1M Fee Distribution,28-Jun-21,0.1,,
109,Cardano Hits New Milestone Surpassing 650K Staking Addresses,27-Jun-21,0.6,,
110,DOGE Analysis: Comparing Previous Cycles to Most Recent Cycle,27-Jun-21,0.1,,
111,UK’s Financial Conduct Authority Warns Consumers Against Binance Markets,27-Jun-21,-0.6,,
112,Ethereum Gas Fees Plunge to Yearly Low,27-Jun-21,0.3,,
113,Andy Warhol NFT ‘Three Self-Portraits’ Sells For $2.8M to Justin Sun,27-Jun-21,0.5,,
114,Bitcoin Mining Hashrate Hits New 13-Month Low,27-Jun-21,-0.2,,
115,LA Summer Camp Relaunches Kids Crypto Crash Course,27-Jun-21,0.2,,
116,Mercuryo Secures $7.5M in Series A Funding Round,26-Jun-21,0.6,,
117,Marvel Announces Official Digital Collectibles are Coming to VeVe,26-Jun-21,0.3,,
118,What the ETF: Kryptoin’s Bitcoin ETF Three Year Wait,26-Jun-21,0.1,,
119,Comparing Ethereum’s Previous Cycle to its Recent Cycle,26-Jun-21,0.1,,
120,FV Bank Partners With Fireblocks For New Digital Asset Custody Service,26-Jun-21,0.4,,
121,On-Chain Analysis: Declining Hashrate Does Not Slow Bitcoin’s Growth,26-Jun-21,0.4,,
122,U.K Police Seize £114M in Bitcoin Tied to Money Laundering,26-Jun-21,-0.7,,
123,China’s Mining Crackdown ‘a Trillion-Dollar Mistake’ Says Saylor,26-Jun-21,-0.5,,
124,Holon Partners With Protocol Labs to Push Decentralized Data Storage,26-Jun-21,0.3,,
125,Japan’s FSA Warns Binance Again For Operating Without a License,25-Jun-21,-0.4,,
126,Jay-Z and Sotheby’s Auctioning Off NFT Commemorating ‘Reasonable Doubt’,25-Jun-21,0.2,,
127,"Ethereum 2.0 Could Increase Adoption, but Poses Centralization Risks",25-Jun-21,-0.3,,
128,Palestine Considering Issuing Digital Currency,25-Jun-21,0.2,,
129,How Long Does a BTC Top Last?,25-Jun-21,0.1,,
130,MultiVAC Blockchain Mainnet Launch Brings New Era of Development,25-Jun-21,0.4,,
131,Tanzania Plan Crypto Ban U-Turn Following President’s Directive,25-Jun-21,0.3,,
132,SHIB Spikes 25% as Elon Musk Tweets About Naming His Dog,25-Jun-21,0.6,,
133,Africrypt Bitcoin Fraud Beyond Reach of South African Regulators,25-Jun-21,-0.8,,
134,Comparing Bitcoin (BTC) and Ethereum (ETH) Price Movement Cycles,25-Jun-21,0.1,,
135,"Layer 2 Solutions Aren’t Always Best, Argues Emin Gün Sirer",25-Jun-21,-0.3,,
136,What Changed in Crypto Markets While You Were Sleeping — June 25,25-Jun-21,0.1,,
137,RabbitHole Raises $3.6M to Build Crypto Participation Platform,25-Jun-21,0.5,,
138,El Salvador Reveals Official Bitcoin Digital Wallet ‘Chivo’,25-Jun-21,0.4,,
139,Robinhood IPO Plans Pushed Back Due to SEC Review Process,25-Jun-21,-0.2,,
140,Circle Aims to Bring USDC DeFi to Businesses and Institutions,25-Jun-21,0.4,,
141,Beeple Launches NFT Site That Highlights Notable Moments in History,24-Jun-21,0.3,,
142,Binance Assists in Taking Down $500M Cybercriminal Ring,24-Jun-21,0.8,,
143,MATIC Continues Descent Alongside Descending Resistance Line,24-Jun-21,-0.4,,
144,"Gold, Stocks, and Bitcoin: Weekly Overview — June 24",24-Jun-21,0.1,,
145,VET Creates Double Bottom With Bounce at Support,24-Jun-21,0.2,,
146,Gemini Green Aimed at Reducing Carbon Footprint of Crypto Industry,24-Jun-21,0.7,,
147,BIC’s Video News Show: Crypto Crash Review,24-Jun-21,-0.3,,
148,BTC On-Chain Analysis: HODL Wave Shows Increased Selling by Medium-Term Holders,24-Jun-21,-0.4,,
149,Digital Assets AG Launching Stock Tokens on Solana,24-Jun-21,0.3,,
150,Andreessen Horowitz Bets Big With $2.2B Crypto Fund,24-Jun-21,0.7,,
151,Bullish Crypto Exchange in Talks to Merge With SPAC,24-Jun-21,0.5,,
152,"BTC, ETH, XRP, XVG, YFII, ANKR, TRX — Technical Analysis June 24",24-Jun-21,0.1,,
153,Lloyd’s Now Accepting Crypto Payments at Auctions,24-Jun-21,0.3,,
154,What Changed in Crypto Markets While You Were Sleeping — June 24,24-Jun-21,0.1,,
155,US Department of Justice Recruiting Crypto Attorney,24-Jun-21,0.1,,
156,"Bitcoin (BTC) Drops Back After Failure to Reclaim $35,000",24-Jun-21,-0.4,,
157,EIP-1559 Nears as Ethereum Upgrade Launches to Testnet,24-Jun-21,0.1,,
158,$3.6 Billion in Bitcoin Disappears with Africrypt Founders,24-Jun-21,-0.9,,
159,Coinbase Unveils Solidify Smart Contract Security Tools,24-Jun-21,0.3,,
160,"John McAfee Found Dead in Spanish Prison Ahead of Extradition to US, Report",23-Jun-21,-0.3,,
161,South Korean Officials Seize $47M in Crypto Due to Unpaid Taxes,23-Jun-21,-0.5,,
162,Russell Simmons to Launch ‘Masterminds of Hip Hop’ NFT Collection,23-Jun-21,0.1,,
163,BIS Says CBDCs Necessary to Keep Government Control of Money,23-Jun-21,-0.1,,
164,Bitmain Halts Sales of Bitcoin Mining Rigs Following China Ban,23-Jun-21,-0.6,,
165,FTX Partners With MLB to Further Expand Crypto Awareness,23-Jun-21,0.4,,
166,Insurance Company Accepting Crypto for Premium Payments,23-Jun-21,0.3,,
167,Step Finance Adds Augmented Reality NFTs to Solana Dashboard,23-Jun-21,0.1,,
168,"CHZ Breaks Out From Wedge, Will HBAR and HNT Follow?",23-Jun-21,0.1,,
169,UK Finance Watchdog Warns Against 111 Crypto Asset Firms,23-Jun-21,-0.7,,
170,"Iranian Police Seize 7,000 Mining Rigs In Latest Raid",23-Jun-21,-0.3,,
171,ADA Prevents Breakdown With Bounce At Long-Term Support Line,23-Jun-21,0.3,,
172,"BTC, ETH, XRP, CHZ, HBAR, XMR, HNT — Tech Analysis, June 23",23-Jun-21,0.1,,
173,Alipay Launches In-App NFT Sales Feature,23-Jun-21,0.1,,
174,SEC Charges CEO of Crypto Startup for Unregistered ICO,23-Jun-21,-0.4,,
175,US Treasury Nominee: Preventing Crypto Money Laundering a Priority,23-Jun-21,-0.2,,
176,"Bitcoin (BTC) Reclaims $33,000 After Sweeping Lows",23-Jun-21,0.4,,
177,Malt Protocol Details Failed Stablecoin Reimbursement Plan,23-Jun-21,-0.3,,
178,Sorare Signs Licensing deal with German National Football Team,22-Jun-21,0.2,,
179,Startup CXIP Labs Sets Sights on Verifying NFTs to Protect Artists,22-Jun-21,0.3,,
180,BIT Mining Begins Moving Thousands of Rigs to Kazakhstan,22-Jun-21,0.1,,
181,DeFi Index Falls as SUSHI and UNI Break Down,22-Jun-21,-0.5,,
182,BIC’s Video News Show: Theta Network (THETA),22-Jun-21,0.1,,
183,PayPal and Visa Among Investors in Blockchain Capital’s $300M Fund,22-Jun-21,0.7,,
184,BTC On-Chain Analysis: SOPR Indicates Market is at a Turning Point,22-Jun-21,0.1,,
185,Nvidia Creating Crypto Specific Graphics Card to Avoid Boom-and-Bust,22-Jun-21,0.1,,
186,Bearish Sentiment Increases as ETH Breaks Down Below Crucial Support,22-Jun-21,-0.7,,
187,Kava Teams up With Simplex Enabling Fiat-to-DeFi Transactions,22-Jun-21,0.3,,
188,El Salvador Opposition Party Files Lawsuit Against Bitcoin Adoption Ruling,22-Jun-21,-0.4,,
189,"BTC, ETH, XRP, CRV, ZEC, SUSHI, DCR — Technical Analysis June 22",22-Jun-21,0.1,,
190,Iconic 70s Singer Auctions NFT and Dinner for Charity,22-Jun-21,0.2,,
191,What Changed in Crypto Markets While You Were Sleeping — June 22,22-Jun-21,0.1,,
192,Bybit Allegedly Violates Ontario Securities Laws,22-Jun-21,-0.6,,
193,Bitcoin (BTC) Falls to Range Lows in Ongoing Dip,22-Jun-21,-0.3,,
194,"Impossible Finance Loses $500,000 in Latest DeFi Flash Loan Attack",22-Jun-21,-0.8,,
195,VanEck Submits Bitcoin Futures Strategy Prospectus to SEC,22-Jun-21,0.1,,
196,Polywhale Team Jumps Ship Amid DeFi Rug Pull Accusations,22-Jun-21,-0.9,,
197,Israel is Already Testing its Central Bank Digital Currency,21-Jun-21,0.1,,
198,"Most Expensive Virtual Plot of Land Ever Sells for $900,000 on Decentraland",21-Jun-21,0.6,,
199,Sotheby’s Continues to Support Crypto With Upcoming Rare Diamond Auction,21-Jun-21,0.3,,
200,Crypto Industry Has Paid $2.5 Billion in Fines Since Bitcoin Inception,21-Jun-21,-0.4,,
201,"MicroStrategy Now Holds Over 100K in BTC Following 13,005 BTC Purchase",21-Jun-21,0.7,,
202,Bitcoin Dominance Continues Ascent Towards 50%,21-Jun-21,0.5,,
203,Understanding Latin America’s Rising Interest in Bitcoin Adoption,21-Jun-21,0.1,,
204,Morgan Stanley Invests $48M in Blockchain Startup Securitize,21-Jun-21,0.6,,
205,"BNB, 1INCH & CAKE Fail to Sustain Upward Movements",21-Jun-21,-0.4,,
206,"PBOC Orders Major Banks, Alipay to Cease Servicing Crypto Companies",21-Jun-21,-0.8,,
207,Five Biggest Altcoin Gainer Showcase — June 14-21,21-Jun-21,0.5,,
208,Bitcoin Leads in $1 Billion 24-Hour Liquidation Pile-Up,21-Jun-21,-0.6,,
209,Jim Cramer Flips Back to Bitcoin Bear: ‘I Think It’s Topping Out’,09-Jan-24,-0.3,,
210,"Bitcoin Price Dip After ETF Approval Predicted, How Low Could It Go? ",09-Jan-24,-0.4,,
211,SEC ‘Delay Signal’ Dismissed as Last Minute ETF Amendments Are Made,09-Jan-24,0.1,,
212,Messari Founder’s Tips for Handling Crypto Profits in the Bull Market,09-Jan-24,0.3,,
213,Solana (SOL) Price Closes Below $100 – Where Will it Find Support?,08-Jan-24,-0.5,,
214,North Korean Hackers Execute Largest BTC Transaction in Over a Month: Arkham,08-Jan-24,-0.6,,
215,Bitfinex Halts Deposits for UK Users Amid Regulatory Clampdown on Crypto Exchanges,08-Jan-24,-0.7,,
216,Is Dogecoin (DOGE) Set for Recovery With Emerging Bullish Pattern?,08-Jan-24,0.3,,
217,Bitcoin ETF Filings Show Suspiciously Low Fees as Cryptocurrency Price Wars Escalate,08-Jan-24,-0.2,,
218,Shiba Inu (SHIB) Reserves on Exchanges Drop 4% as Whales Continue to Accumulate,08-Jan-24,0.6,,
219,How Bitcoin (BTC) ETFs Could Play Into the US Agenda to Ban Crypto,08-Jan-24,-0.4,,
220,SEC Warns Against FOMO as Investors Await Spot Bitcoin ETF Approval,08-Jan-24,-0.3,,
221,Binance Releases New Proof of Reserves,08-Jan-24,0.2,,
222,Solana Rug Pull Has Begun: Max Keiser,08-Jan-24,-0.9,,
223,This Rare Ethereum (ETH) vs. Bitcoin (BTC) Signal Appears for the Third Time Ever,08-Jan-24,0.1,,
224,Could a Ripple (XRP) ETF Be on the Horizon After Bitcoin?,08-Jan-24,0.2,,
225,Real Estate Mogul Investing in Blockchain-Based Social Network,21-Jun-21,0.4,,
226,Polkadot (DOT) Struggles to Hold Support After Breakdown,21-Jun-21,-0.5,,
227,Amber Group Raises $100M for Crypto Trading Platform Expansion,21-Jun-21,0.6,,
228,What Changed in Crypto Markets While You Were Sleeping — June 21,21-Jun-21,0.1,,
229,Malta Investigated for ‘Lax Oversight’ on Crypto Transactions,21-Jun-21,-0.5,,
230,"Bitcoin (BTC) Has Roller Coaster Weekend, Revisits Crucial Support",21-Jun-21,-0.2,,
231,ECB Executive: Digital Euro Can Protect Privacy Better Than Private Alternatives,21-Jun-21,0.3,,
232,"Visor Finance Releases $500,000 DeFi Heist Post Mortem Report",21-Jun-21,-0.7,,
233,Stock to Flow Analysis: Worst Case Scenario Could See $135K BTC by December,20-Jun-21,0.8,,
234,One of North America’s Biggest Miners Harnesses Flare Gas Energy,20-Jun-21,0.4,,
235,Bitcoin Mining Hash Rate Drops to Lowest in 180 Days,20-Jun-21,-0.3,,
236,Central Bank of Portugal Grants Licenses to Crypto Exchanges,20-Jun-21,0.4,,
237,Germany to Test Run Digital Certificates Using Blockchain Technology,20-Jun-21,0.2,,
238,TSB Bank Bars Customers From Sending Funds to Binance and Kraken,20-Jun-21,-0.6,,
239,Nexo Co-Founder Calls for $100k BTC Price Target,19-Jun-21,0.8,,
240,Ethereum Testnets Continue as London Hardfork Approaches,19-Jun-21,0.1,,
241,Juventus F.C. Expands NFT Offering With NFT Pro Partnership,19-Jun-21,0.3,,
242,13 New Assets Under Consideration for Grayscale Investment Product Line,19-Jun-21,0.2,,
243,"Saylor Compares BTC to Early Apple: ‘No One Can Stop, and Few Understand’",19-Jun-21,0.5,,
244,Decentral Games Announces $5M Capital Raise With New Partners,19-Jun-21,0.6,,
245,Venture Capital Funds Have Invested a Record $17B Into Crypto in 2021,19-Jun-21,0.7,,
246,SOL Attempts to Find Support After Breakdown,19-Jun-21,-0.4,,
247,Chinese Officials in Ya’an Carry Out Crypto Mining Bans,18-Jun-21,-0.7,,
248,Canadian Elite Basketball League Offers BTC as Salary Payment to Players,18-Jun-21,0.5,,
249,Goldman Sachs Begins Trading BTC Futures,18-Jun-21,0.4,,
250,Barrett-Jackson Set to Auction off Four NFTs of Rare VIN 001 Cars,18-Jun-21,0.3,,
251,SEC Omits Cryptocurrency From 2021 Regulatory Agenda,18-Jun-21,0.0,,
252,BBVA Switzerland Opens Crypto-Asset Trading to Private Clients,18-Jun-21,0.5,,
253,"The Magnificent Seven: QNT, AMP, FTM, TFUEL, WAVES, SHIB, THETA— Biggest Gainers, June 11-18",18-Jun-21,0.7,,
254,Miami Mayor Says Chinese Bitcoin Miners Welcome,18-Jun-21,0.3,,
255,"DOT, ANKR and REEF – Indecision Looms Large Within DOT Ecosystem",18-Jun-21,-0.2,,
256,Australian Senate Committee: Blockchain Could Curb Imports of Forced Labor Goods,18-Jun-21,0.1,,
257,"The Hateful Eight: KSM, ICP, NEXO, DGB, BTG, SC, BTT, QTUM — Biggest Losers, June 11-18",18-Jun-21,-0.6,,
258,MSCI Explores Launching Crypto Asset Indices,18-Jun-21,0.3,,
259,Digital Renminbi and Cash Exchange Service ATMs Launch in Beijing,18-Jun-21,0.1,,
260,What Changed in Crypto Markets While You Were Sleeping — June 18,18-Jun-21,0.0,,
261,"Kraken Could Go Public in 2022, CEO Says Prep Work Being Done",18-Jun-21,0.3,,
262,Mattel Speeds into the NFT World With Hot Wheels Digital Collection,18-Jun-21,0.3,,
263,Bitcoin (BTC) Falls to Support Following Breakout Failure,18-Jun-21,-0.4,,
264,Displaced Chinese Bitcoin Miners Are Flocking to Texas,18-Jun-21,0.1,,
265,Iron Finance Details DeFi ‘Bank Run’ and Titan Token Collapse,18-Jun-21,-0.8,,
266,Socios Announce First NBA Partnership With Philadelphia 76ers,17-Jun-21,0.5,,
267,KSM Finds Support After Breakdown,17-Jun-21,0.3,,
268,"Gold, Stocks, and Bitcoin: Weekly Overview — June 17",17-Jun-21,0.0,,
269,"TRB, RLC and DIA : Oracle Tokens Validate Long-Term Support Levels",17-Jun-21,0.3,,
270,Landon Cassill Becomes First NASCAR Driver to be Paid Entirely in Crypto,17-Jun-21,0.5,,
271,BIC’s Video News Show: Is Telcoin a Good Investment?,17-Jun-21,0.0,,
272,On-Chain Analysis: Interest in ETH Remains High Despite Correction,17-Jun-21,0.4,,
273,Argon Puts Work on the Blockchain to Get Freelancers Paid,17-Jun-21,0.1,,
274,McLaren Formula One Team Partners With Tezos to Create NFT Collection,17-Jun-21,0.5,,
275,TOMO Increases Towards Crucial Resistance Level – Will it Break Out?,17-Jun-21,0.0,,
276,UK Regulator Finds Understanding of Crypto Decreased as Ownership Increased,17-Jun-21,-0.3,,
277,Waves’ Duck Hunters NFT Game Integrating DeFi Features,17-Jun-21,0.3,,
278,Bitcoin (BTC) Most Undervalued in 10 Years According to Stock-to-Flow Model,17-Jun-21,0.5,,
279,US Republican House Committee Accepting Crypto Donations,17-Jun-21,0.1,,
280,World Bank Denies El Salvador Assistance With Bitcoin Implementation,17-Jun-21,-0.3,,
281,"BTC, ETH, XRP, DIA, DASH, ATOM, WAVES — Technical Analysis June 17",17-Jun-21,0.0,,
282,Korean Authorities Requesting List of Delisted Altcoins From Crypto Exchanges,17-Jun-21,-0.3,,
283,What Changed in Crypto Markets While You Were Sleeping — June 17,17-Jun-21,0.0,,
284,Kyber to Launch on Polygon With $30M Rewards For Liquidity Providers,17-Jun-21,0.6,,
285,Bitcoin (BTC) Searches for Support After Failure to Break Out,17-Jun-21,-0.2,,
286,"SEC Delays VanEck Bitcoin ETF Decision Yet Again, Deadline Pushed to July",17-Jun-21,-0.1,,
287,Alchemix DeFi Protocol Fixes Reverse Rug Pull Vulnerability,17-Jun-21,0.4,,
288,Travala Releases Blockchain-Powered Competitor to Airbnb,16-Jun-21,0.1,,
289,Skrapper Legends NFT Collection Honors Babe Ruth,16-Jun-21,0.1,,
290,Journal of Financial Planning Survey Shows More Financial Advisors Support Crypto,16-Jun-21,0.5,,
291,ICX Continues Descent After Rejection From Long-Term Resistance,16-Jun-21,-0.5,,
292,Analysts Believe CBDCs Will Ultimately Compliment Crypto,16-Jun-21,0.1,,
293,BoE Governor Advocates Stablecoins but Warns of Crime Risk,16-Jun-21,-0.2,,
294,Zcash Upcoming Upgrade First Step in Move Away From Trusted Setup,16-Jun-21,0.1,,
295,"ADA, LTC and NEO – High Cap Altcoins Struggle to Recover After Sharp Drop",16-Jun-21,-0.4,,
296,Regulators Growing Concerned Over Stablecoin Risks,16-Jun-21,-0.3,,
297,Step Finance Dashboard Aggregating Solana Decentralized Exchanges,16-Jun-21,0.1,,
298,EOS Struggles to Regain Footing After Rejection From Long-Term Resistance,16-Jun-21,-0.3,,
299,Fox Pours $100M Into NFT Creation Fund,16-Jun-21,0.3,,
300,"BTC, ETH, XRP, CRV, CHZ, XMR, SHIB — Technical Analysis June 16",16-Jun-21,0.0,,
301,Crypto Ban Bill in India Under Review,16-Jun-21,0.1,,
302,What Changed in Crypto Markets While You Were Sleeping — June 16,16-Jun-21,0.0,,
303,"Bitcoin (BTC) Makes Breakout Attempt Above $41,250",16-Jun-21,0.3,,
304,El Salvador Minister Clarifies Bitcoin Salary Payment Stipulations,16-Jun-21,0.1,,
305,Indonesian Central Bank Prohibits Cryptocurrency as Payment Tool,16-Jun-21,-0.5,,
306,Secret Binance Smart Chain Bridge Launches to Mainnet,16-Jun-21,0.2,,
307,NFT Marvel Marketplace Coming to Binance Smart Chain,15-Jun-21,0.2,,
