index,Headline,Date,pred_score,Headline_x,Headline_y
1682,,30-Mar-21,0.2,Bakkt Launches a Digital Wallet App,Bakkt Launches a Digital Wallet App
1683,,30-Mar-21,0.5,Ripple Labs to Acquire 40% Stake in Tranglo,Ripple Labs to Acquire 40% Stake in Tranglo
1684,,30-Mar-21,-0.3,SEC Commissioner: Delaying Bitcoin ETF May Have Consequences,SEC Commissioner: Delaying Bitcoin ETF May Have Consequences
1685,,30-Mar-21,0.0,"BTC, XRP, ETH, XLM, XEM, ATOM, LINK: Technical Analysis For March 30","BTC, XRP, ETH, XLM, XEM, ATOM, LINK: Technical Analysis For March 30"
1686,,30-Mar-21,0.1,"US, EU Regulators Meet & Discuss Stablecoins & CBDCs","US, EU Regulators Meet & Discuss Stablecoins & CBDCs"
1687,,30-Mar-21,0.7,Zilliqa (ZIL) Closes in on Reaching New All-Time High,Zilliqa (ZIL) Closes in on Reaching New All-Time High
1688,,30-Mar-21,0.6,PayPal Launches Crypto Checkout Payment Solution,PayPal Launches Crypto Checkout Payment Solution
1689,,30-Mar-21,0.8,Bitcoin Market Cap Exceeds Australia’s M1 Money Supply,Bitcoin Market Cap Exceeds Australia’s M1 Money Supply
1690,,30-Mar-21,0.7,Holo (HOT) Price Spikes Following US Patent Approval,Holo (HOT) Price Spikes Following US Patent Approval
1691,,30-Mar-21,0.3,Bitcoin Value Potential Being Researched by America’s Oldest Bank,Bitcoin Value Potential Being Researched by America’s Oldest Bank
1692,,30-Mar-21,-0.9,SEC Charges LBRY with Sale of Unregistered Securities,SEC Charges LBRY with Sale of Unregistered Securities
1693,,30-Mar-21,0.2,Bitcoin (BTC) Completes Correction with Short-Term Breakout,Bitcoin (BTC) Completes Correction with Short-Term Breakout
1694,,30-Mar-21,0.0,What Changed in Crypto Markets While You Were Sleeping — March 30,What Changed in Crypto Markets While You Were Sleeping — March 30
1695,,30-Mar-21,0.1,Polkamon NFT Eggs Generate Over $1 Million in Gas Fees,Polkamon NFT Eggs Generate Over $1 Million in Gas Fees
1696,,30-Mar-21,0.6,Visa Settlements Enhance Ethereum as ‘Ultra Sound Money’,Visa Settlements Enhance Ethereum as ‘Ultra Sound Money’
1697,,29-Mar-21,0.1,Mets Player to Launch NFT To Help Minor League Players,Mets Player to Launch NFT To Help Minor League Players
1698,,29-Mar-21,0.8,Market Roundup: Bitcoin Looking Bullish as ETH Jumps 8%,Market Roundup: Bitcoin Looking Bullish as ETH Jumps 8%
1699,,29-Mar-21,0.1,Dubai Regulators Propose Security Token Regulation,Dubai Regulators Propose Security Token Regulation
1700,,29-Mar-21,0.1,Indian Crypto Exchanges Prepare Presentation for Regulators,Indian Crypto Exchanges Prepare Presentation for Regulators
1701,Mogo Gives Customers BTC on Mortgage Payments,29-Mar-21,0.5,,
1702,XRP Attempts to Break Out Above Long-Term Resistance,29-Mar-21,0.3,,
1703,Justin Sun Establishes JUST NFT Fund,29-Mar-21,0.1,,
1704,ADA Bounces and Aims for New All-Time High,29-Mar-21,0.7,,
1705,"NEO, BNB, LTC: Technical Analysis For March 29",29-Mar-21,0.1,,
1706,3.5 Million Customers KYC Information Leaked in Alleged MobiKwik Hack,29-Mar-21,-0.8,,
1707,PwC Report: 2021 Crypto M&A to Grow After Reaching $1.1B in 2020,29-Mar-21,0.4,,
1708,Visa Now Settling Transactions with USD Coin on Ethereum,29-Mar-21,0.7,,
1709,"Five Biggest Altcoin Gainers, March 22-29",29-Mar-21,0.3,,
1710,BeInCrypto CEO Alena Afanaseva to Lecture on NFTs and Blockchain at Plekhanov University,29-Mar-21,0.2,,
1711,Miami Mayor: Bitcoin Miners Should Move to Miami for Nuclear Power,29-Mar-21,0.3,,
1712,New York State Releases IBM Blockchain COVID-19 Passport Application,29-Mar-21,0.1,,
1713,Ethereum 2.0 Staking Contract Reaches 3.6 Million ETH,29-Mar-21,0.3,,
1714,"Bitcoin (BTC) Bounces Back, Aiming for Higher Prices",29-Mar-21,0.5,,
1715,What Changed in Crypto Markets While You Were Sleeping — March 29,29-Mar-21,0.1,,
1716,PancakeSwap DeFi DEX Details Patched Lottery Bug,29-Mar-21,-0.2,,
1717,DODO DEX Launching Fractional NFTs and ‘Raptor Program’,29-Mar-21,0.1,,
1718,"Weekend Roundup: Bitcoin Holds Firm at $56,000",28-Mar-21,0.3,,
1719,Solana (SOL) Rises with AscendEX and OKEx Partnerships,28-Mar-21,0.6,,
1720,"Altcoins Of The Week: ANKR, DENT, BTMX",28-Mar-21,0.1,,
1721,Bitcoin on the Back of the Envelope: up 63% in April?,28-Mar-21,0.5,,
1722,Musk Effect #2 May Be a Serious One,28-Mar-21,0.1,,
1723,NFT Watch Auction Could Change the Luxury Watch Industry,28-Mar-21,0.3,,
1724,Miner Hut 8 Purchases $30 Million of Nvidia CMPs,28-Mar-21,0.3,,
1725,"Market Roundup: Bitcoin Rebuilding to $56,000",27-Mar-21,0.3,,
1726,Beeple Purchaser Was Two Indian Crypto Traders,27-Mar-21,0.1,,
1727,IQQ Rivals CHZ and Soars as Interest in Sports Blockchain Surges,27-Mar-21,0.5,,
1728,Grayscale Posts Holdings and AUM Update,27-Mar-21,0.1,,
1729,Test Your Crypto Knowledge With BIC’s Weekly Quiz — March 27,27-Mar-21,0.1,,
1730,Answers to BeInCrypto’s Weekly Quiz — March 27,27-Mar-21,0.1,,
1731,Filecoin Rises on Interconnects and Chinese Interest,27-Mar-21,0.5,,
1732,Bitcoin Analysts Chainalysis Doubles in Valuation to $2 Billion,27-Mar-21,0.3,,
1733,"Market Roundup: Friday Bounce Sees Bitcoin Recover To $53,500 While Altcoins Rally",26-Mar-21,0.5,,
1734,5 Centralized Exchanges Supporting the DeFi Revolution,26-Mar-21,0.1,,
1735,"The Magnificent Seven: DENT, BTT, ANKR, NPXS, ONE, CAKE, THETA – Biggest Gainers, March 19-26",26-Mar-21,0.1,,
1736,"BeInCrypto Weekly News Round-Up: March 26, 2021",26-Mar-21,0.1,,
1737,"BTC, ETH, XRP, STEEM, REP, BTT, CHSB & UNI: Technical Analysis For March 26",26-Mar-21,0.1,,
1738,NFT Global Conference Scheduled on March 30,26-Mar-21,0.1,,
1739,"The Hateful Eight: AVAX, ATOM, SUSHI, MATIC, FTM, CHZ, NEAR, UMA – Biggest Losers, March 19-26",26-Mar-21,-0.1,,
1740,Optimism Deems Original Mainnet Launch Timeline Too Ambitious,26-Mar-21,-0.3,,
1741,"$6 Billion Options Expire as Bitcoin Holds $52,000",26-Mar-21,0.1,,
1742,"New York Times Sells Article NFT for $560,000",26-Mar-21,0.3,,
1743,Sophia the Robot NFT Sales Rake in $1 Million,26-Mar-21,0.3,,
1744,Bank Of Japan Committee for CBDC Experimentation a ‘Necessary Step’,26-Mar-21,0.1,,
1745,Argo to Launch First Bitcoin Mining Pool on Clean Energy,26-Mar-21,0.5,,
1746,Theta Network Postpones 3.0 Mainnet Launch,26-Mar-21,-0.3,,
1747,Soros Fund Interested in Crypto Infrastructure Says CIO,26-Mar-21,0.3,,
1748,"Bitcoin (BTC) Bounces, Stays Afloat Above $50,000",26-Mar-21,0.3,,
1749,What Changed in the Crypto Markets While You Were Sleeping — March 26,26-Mar-21,0.1,,
1750,Staked Ethereum Trust Launched Targeting Institutional Investors,26-Mar-21,0.3,,
1751,VeryNifty Trading Protocol Unveils NFT Flash Loan Feature,26-Mar-21,0.1,,
1752,"Market Roundup: Bitcoin Hits Two Week Low As $50,000 Support Holds",25-Mar-21,-0.3,,
1753,"Gold, Stocks, and Bitcoin: Weekly Overview – March 25",25-Mar-21,0.1,,
1754,Microsoft Launches Identity Platform on Bitcoin’s Blockchain,25-Mar-21,0.5,,
1755,BIC’s Crypto Video News Show: Top 5 Altcoins for April,25-Mar-21,0.1,,
1756,Bitcoin Stumbles as $6 Billion Options Near Expiration,25-Mar-21,-0.2,,
1757,CUDOS Shows Early Signs Of An Upward Movement,25-Mar-21,0.3,,
1758,$2.4 Billion Futures Contracts Liquidated in 24 Hours,25-Mar-21,-0.6,,
1759,Cboe ETF Filing Latest in String of Attempts,25-Mar-21,0.1,,
1760,"BCH, XVG & DNT: Technical Analysis For March 25",25-Mar-21,0.1,,
1761,Huobi Discusses Crypto Regulations at GDF Asia Conference,25-Mar-21,0.1,,
1762,Top Crypto Job Sites — Find Work and Be Paid in Crypto,25-Mar-21,0.1,,
1763,Outlining Potential Bitcoin (BTC) Wave Counts,25-Mar-21,0.1,,
1764,Bitcoin Taproot Upgrade Activation Proposed for November,25-Mar-21,0.1,,
1765,Fidelity and Goldman Sachs File for Bitcoin ETFs with SEC,25-Mar-21,0.3,,
1766,Cryptocurrency Investments with Stimulus Checks Surge in the US,25-Mar-21,0.3,,
1767,Bitcoin (BTC) Drops to ‘Make or Break’ Support Level,25-Mar-21,-0.3,,
1768,"Opium DeFi Protocol Launches BSC Staking, Offering 1,900% APY",25-Mar-21,0.1,,
1769,DeFi Tokens See Red as Crypto Market Correction Deepens,25-Mar-21,-0.7,,
1770,"Market Roundup: Bitcoin Taps $57,000 as Market Sees Recovery",24-Mar-21,0.4,,
1771,Crypto Influencers: Top 5 People Making Waves in the Market March 17-24,24-Mar-21,0.1,,
1772,"Binance Mints NFTs on BSC to Award Users, Plans to Make Initiative Global",24-Mar-21,0.1,,
1773,Binance Signs MoU With CapBridge For Future Collaboration,24-Mar-21,0.1,,
1774,Microsoft President Says Governments Still Best-Placed to Issue Currency,24-Mar-21,-0.1,,
1775,Wirex Suspends New Registrations to Improve AML in UK,24-Mar-21,-0.3,,
1776,"DOT, UNI & the DeFi Index Reach New All-Time Highs",24-Mar-21,0.8,,
1777,Covalent Closes Strategic $2 Million Funding Round,24-Mar-21,0.2,,
1778,100-Year-Old Painting to Enter NFT Market,24-Mar-21,0.1,,
1779,Breez Utilizes Lightning Network to Pay Podcasters,24-Mar-21,0.1,,
1780,Top Cryptocurrency Airdrops to Look Out for Right Now,24-Mar-21,0.1,,
1781,"TOMO, TFUEL, PPT: Technical Analysis For March 24",24-Mar-21,0.1,,
1782,NFT Vendor Dibbs Raises $2.8 Million in Seed Funding,24-Mar-21,0.2,,
1783,Blockchain.com Secures $300 Million in Series C Funding,24-Mar-21,0.7,,
1784,"LUNA, ALGO, KSM: Technical Analysis March 24",24-Mar-21,0.1,,
1785,Robinhood Trading App Files for Confidential IPO with SEC,24-Mar-21,0.1,,
1786,Elon Musk: Tesla Now Accepts Bitcoin as Payment,24-Mar-21,0.8,,
1787,Coinbase CEO Brian Armstrong Receives $14 Billion in Stock Ahead of Listing,24-Mar-21,0.1,,
1788,Bitcoin (BTC) Regains Footing and Begins to Bounce,24-Mar-21,0.4,,
1789,Can Uniswap v3 Help Alleviate the Ethereum Gas Crisis?,24-Mar-21,0.1,,
1790,NFT Farming Protocol MEME Joins Nifty’s Social Platform Launch,24-Mar-21,0.1,,
1791,Enjin and GameTalkTalk to Release Sustainable NFTs,23-Mar-21,0.1,,
1792,"Market Roundup: Bitcoin Recovers to $55k, Top 10 Shakeup Continues",23-Mar-21,0.3,,
1793,Ripple CEO Envisions $5 Trillion Crypto Market Amid Regulatory Optimism,08-Apr-24,0.5,,
1794,Costa Rica’s Bitcoin Future: Legal Clampdown on the Horizon,07-Apr-24,-0.4,,
1795,Cathie Wood Praises Crypto Regulation in Hong Kong,07-Apr-24,0.3,,
1796,Andre Cronje to Help Launch Meme Coins on Fantom,07-Apr-24,0.1,,
1797,Aave’s Fee Distribution Plan Is a Win for Holders,07-Apr-24,0.4,,
1798,Solana (SOL) Risks Falling to $137: An In-depth Look,06-Apr-24,-0.5,,
1799,Pendle Finance Could Be the Next Big Leap in DeFi’s Evolution,06-Apr-24,0.1,,
1800,Bitcoin Halving Could Be a Green Light for Investors,06-Apr-24,0.3,,
1801,Solana Boosts Pantera Capital’s Fund by 66% in Q1: Insights,06-Apr-24,0.66,,
1802,Terraform Labs Fights Back: SEC’s Charges Spark Legal Showdown,06-Apr-24,-0.1,,
1803,Shiba Inu’s Future Looks Grim: Slow Network Activity to Blame,06-Apr-24,-0.75,,
1804,"Ripple (XRP) Loses Its Shine as Solana, Polkadot Gain Ground",05-Apr-24,-0.2,,
1805,"This Weekend Could See Bitcoin Break $70,000",05-Apr-24,0.5,,
1806,FTX Sold 30 Million Solana (SOL) Tokens at a 60% Discount,05-Apr-24,-0.5,,
1807,Render Network (RNDR) Price Dilemma: Investor Confidence vs. Whale Caution,05-Apr-24,-0.1,,
1808,JPMorgan Is Bullish on Ethereum ETF Approval,05-Apr-24,0.75,,
1809,Will Arbitrum (ARB) Reach New All-Time High After 60% Increase in December?,28-Dec-23,0.5,,
1810,Is a Rally in Sight for Dogecoin (DOGE) Amid Increasing Address Count?,28-Dec-23,0.2,,
1811,Donald Trump Reportedly Sells $2.4M Worth of Ethereum (ETH) Amidst 10% Price Surge,28-Dec-23,0.1,,
1812,Why Ripple Transferred 310 Million XRP Out of Escrow,28-Dec-23,0.0,,
1813,Chainlink (LINK) Bulls in Control as Price Hits Yearly High – $20 on the Horizon?,28-Dec-23,0.85,,
1814,Artificial Intelligence Tops Crypto Narratives in 2023 as AI Tokens Explode,28-Dec-23,0.65,,
1815,Experts Confirm Bitcoin ETFs Will Actually Be BTC Backed,28-Dec-23,0.2,,
1816,Capital Fund Poised to Invest Billions in the Web3 Industry,28-Dec-23,0.5,,
1817,Worldcoin’s Global Footprint Grows with Singapore Launch,28-Dec-23,0.2,,
1818,Prominent Bitcoin Maxi Challenges Cathie Wood’s Bitcoin ETF Claim,27-Dec-23,-0.3,,
1819,Will Increased Ethereum (ETH) Network Activity Fuel a Price Surge?,27-Dec-23,0.3,,
1820,Altcoins in Focus: Are Whales Accumulating These 2 Cryptos?,27-Dec-23,0.1,,
1821,SEI Continues December Rise With Yet Another All-Time High,27-Dec-23,0.75,,
1822,Crypto Hedge Funds Expect a Bumper 2024 Amid Price Shocks From ETFs and BTC Halving,27-Dec-23,0.5,,
1823,BNB Sets Sights on New Yearly High After Moving Above $300,27-Dec-23,0.75,,
1824,Hong Kong Solicits Comment on New Stablecoin Legislation,27-Dec-23,0.1,,
1825,Crypto Exchanges Now Hold Lowest Amount of Bitcoin Ever,23-Mar-21,-0.2,,
1826,Pi Cycle: Is the Bitcoin Bull Run Coming to an End?,23-Mar-21,-0.3,,
1827,BTCD Shows Potential Signs Of A Breakdown,23-Mar-21,-0.65,,
1828,BIC’s Crypto Video News Show: Will XRP Get Relisted on Exchanges?,23-Mar-21,0.1,,
1829,OKEx to Cease Operations in South Korea,23-Mar-21,-0.3,,
1830,"$1.58 Billion Liquidated Across Exchanges as Bitcoin Falls Below $57,800",23-Mar-21,-0.85,,
1831,Theta Breaks Top 10 in Market Cap,23-Mar-21,0.5,,
1832,Sophia the Robot NFTs Set to Go Live on Nifty Gateway,23-Mar-21,0.2,,
1833,Cardano Founder Calls Out DApp Ecosystem and Ethereum Model,23-Mar-21,-0.4,,
1834,TIME Seeking CFO Comfortable with Bitcoin,23-Mar-21,0.1,,
1835,"STORJ, FIL & BLZ: Technical Analysis For March 23",23-Mar-21,0.0,,
1836,Harmony Protocol Changes Open Source License After Ethereum Developer Claims Infringement,23-Mar-21,-0.2,,
1837,NFT Artwork by Beeple Fetches $6 Million for Charity,23-Mar-21,0.4,,
1838,"BTC, ETH, XRP, TRX, IOTA, NEO, ATOM: Technical Analysis March 23",23-Mar-21,0.0,,
1839,Structured Crypto Products to Offer More Profitable Alternatives to Bank Deposits,23-Mar-21,0.3,,
1840,China CBDC Research Head: Digital Yuan Has Highest Privacy Protection,23-Mar-21,0.2,,
1841,"Bitcoin (BTC) Falls Below $57,800 Support Level",23-Mar-21,-0.5,,
1842,FATF Cryptocurrency Guidance Revisions Raise Privacy Concerns,23-Mar-21,-0.3,,
1843,Alpha Finance Announces Cross-Chain DeFi Staking and Tokenomics,23-Mar-21,0.2,,
1844,BIC Wins Award for Best Cryptocurrency News Website,23-Mar-21,0.9,,
1845,Uniswap Drops v3 Teasers — What to Expect from the Big Upgrade,23-Mar-21,0.2,,
1846,"Market Roundup: Bitcoin Weakness Sees $55,000 as Market Sees Red",22-Mar-21,-0.65,,
1847,"Fed Chairman Not Interested in Crypto, But Calls Them Substitute To Gold",22-Mar-21,-0.1,,
1848,Twitter CEO Jack Dorsey’s First Tweet Sold As An NFT For $2.9 Million,22-Mar-21,0.4,,
1849,Ripple Touts XRP as a Neutral Bridge Currency for CBDCs,22-Mar-21,0.2,,
1850,"XRP, ZEC, CAKE: Technical Analysis For March 22",22-Mar-21,0.0,,
1851,,22-Mar-21,0.1,Ethereum 2.0 Update – Scaling is Critical,Ethereum 2.0 Update – Scaling is Critical
1852,,22-Mar-21,0.3,BAT Surpasses $1 While LINK Stalls,BAT Surpasses $1 While LINK Stalls
1853,,22-Mar-21,0.7,Five Biggest Altcoin Gainers from March 15-22,Five Biggest Altcoin Gainers from March 15-22
1854,,22-Mar-21,-0.4,U.S. CBDC Program Draws Flak From Wall Street,U.S. CBDC Program Draws Flak From Wall Street
1855,,22-Mar-21,0.1,Alchemy Facilitating $1 Billion NFT Market,Alchemy Facilitating $1 Billion NFT Market
1856,,22-Mar-21,0.1,SatoshiSwap to Feature Decentralized Trading Protocol on Binance Smart Chain,SatoshiSwap to Feature Decentralized Trading Protocol on Binance Smart Chain
1857,,22-Mar-21,0.8,"KAVA Retests Previous All-Time High, Aims for Higher Prices","KAVA Retests Previous All-Time High, Aims for Higher Prices"
1858,,22-Mar-21,0.2,"Bitcoin Google Searches Jump 500% in Turkey, Economic Uncertainty Looms","Bitcoin Google Searches Jump 500% in Turkey, Economic Uncertainty Looms"
1859,,22-Mar-21,0.1,"Beeple Auctioning NFT for Charity, Attracts $1.5 Million Bid","Beeple Auctioning NFT for Charity, Attracts $1.5 Million Bid"
1860,,22-Mar-21,0.1,"Bitcoin (BTC) Consolidates Just Below $60,000","Bitcoin (BTC) Consolidates Just Below $60,000"
1861,,22-Mar-21,0.3,Yearn Finance v2 Vaults Surpass v1 Value in Two Months,Yearn Finance v2 Vaults Surpass v1 Value in Two Months
1862,,22-Mar-21,0.1,Decentralized FLOAT Stablecoin will Complement RAI and FEI Economies,Decentralized FLOAT Stablecoin will Complement RAI and FEI Economies
1863,,21-Mar-21,-0.5,Bitcoin May Turn Bearish in 2022 Says Big Chinese Miner,Bitcoin May Turn Bearish in 2022 Says Big Chinese Miner
1864,,21-Mar-21,0.1,"Weekend Roundup: Bitcoin Wanders in Upper $50,000s","Weekend Roundup: Bitcoin Wanders in Upper $50,000s"
1865,,21-Mar-21,-0.2,ETH Supply on Exchanges Hits 28-Month Low,ETH Supply on Exchanges Hits 28-Month Low
1866,,21-Mar-21,-0.7,CFTC Slaps Coinbase with $6.5 Million Fine,CFTC Slaps Coinbase with $6.5 Million Fine
1867,,21-Mar-21,0.6,"Bitcoin Now too Important to Ignore, Says Deutsche Bank","Bitcoin Now too Important to Ignore, Says Deutsche Bank"
1868,,21-Mar-21,0.7,XRP Rises as Observers Claim Ripple 1 – SEC 0,XRP Rises as Observers Claim Ripple 1 – SEC 0
1869,,21-Mar-21,0.1,XYM Begins to Filter into the World,XYM Begins to Filter into the World
1870,,20-Mar-21,-0.3,Security Concerns Lead Crypto.com – Chainalysis Partnership,Security Concerns Lead Crypto.com – Chainalysis Partnership
1871,,20-Mar-21,0.1,"Market Roundup: Bitcoin Rests Under $60,000","Market Roundup: Bitcoin Rests Under $60,000"
1872,,20-Mar-21,-0.8,Rugpull Hack on BSC Nets 9000 BNB,Rugpull Hack on BSC Nets 9000 BNB
1873,,20-Mar-21,0.1,Test Your Crypto Knowledge With BIC’s Weekly Quiz — March 20,Test Your Crypto Knowledge With BIC’s Weekly Quiz — March 20
1874,,20-Mar-21,0.1,Answers to BeInCrypto’s Weekly Quiz — March 20,Answers to BeInCrypto’s Weekly Quiz — March 20
1875,,20-Mar-21,0.6,LINK Bounces And Aims For All-Time High Resistance,LINK Bounces And Aims For All-Time High Resistance
1876,,20-Mar-21,-0.2,On-chain Analysis: BTC and LINK Draining from Exchanges,On-chain Analysis: BTC and LINK Draining from Exchanges
1877,,20-Mar-21,-0.1,NFT with Fleetwood Mac’s “Dreams” Nixed by Stevie Nicks,NFT with Fleetwood Mac’s “Dreams” Nixed by Stevie Nicks
1878,,19-Mar-21,0.7,Brazil Gets First Bitcoin ETF in South America,Brazil Gets First Bitcoin ETF in South America
1879,,19-Mar-21,0.1,5 Things All DeFi Enthusiasts Should Know,5 Things All DeFi Enthusiasts Should Know
1880,,19-Mar-21,-0.8,"The Hateful Eight: TFUEL, CAKE, CEL, NEAR, OKB, SOL, EGLD, VGX – Biggest Losers, March 15-19","The Hateful Eight: TFUEL, CAKE, CEL, NEAR, OKB, SOL, EGLD, VGX – Biggest Losers, March 15-19"
1881,,19-Mar-21,0.1,"BeInCrypto Weekly News Round-Up: March 19, 2021","BeInCrypto Weekly News Round-Up: March 19, 2021"
1882,,19-Mar-21,0.1,Crypto Billionaires: The Richest People in the Cryptocurrency Game,Crypto Billionaires: The Richest People in the Cryptocurrency Game
1883,,19-Mar-21,0.8,"The Magnificent Seven: HOT, ONE, NPXS, SC, FIL, MANA & LUNA – Biggest Gainers, March 15-19","The Magnificent Seven: HOT, ONE, NPXS, SC, FIL, MANA & LUNA – Biggest Gainers, March 15-19"
1884,,19-Mar-21,0.1,"Top 5 People Making Waves in Crypto Market, March 11—18","Top 5 People Making Waves in Crypto Market, March 11—18"
1885,,19-Mar-21,0.1,Chiliz Launches Manchester City NFT,Chiliz Launches Manchester City NFT
1886,,19-Mar-21,0.1,Blockchain Experiments Aim to Improve Waste Management,Blockchain Experiments Aim to Improve Waste Management
1887,,19-Mar-21,0.1,"BNB, CAKE, CEL: Technical Analysis for March 19","BNB, CAKE, CEL: Technical Analysis for March 19"
1888,,19-Mar-21,0.1,Anthony Scaramucci Compares Bitcoin Value to Amazon Stock,Anthony Scaramucci Compares Bitcoin Value to Amazon Stock
1889,,19-Mar-21,0.1,Morgan Stanley Allegedly Bids on Bithumb Ownership Stake,Morgan Stanley Allegedly Bids on Bithumb Ownership Stake
1890,,19-Mar-21,0.6,DeFi Derivatives Vega Platform Secures $5 Million Funding Round,DeFi Derivatives Vega Platform Secures $5 Million Funding Round
1891,,19-Mar-21,0.4,Bitcoin (BTC) Pushes to Reclaim Previous All-Time High Resistance,Bitcoin (BTC) Pushes to Reclaim Previous All-Time High Resistance
1892,,19-Mar-21,0.4,Bitcoin ATMs See 20% Installation Boost in 2021,Bitcoin ATMs See 20% Installation Boost in 2021
1893,,19-Mar-21,0.5,OpenSea Completes $23 Million Funding Round Led by a16z,OpenSea Completes $23 Million Funding Round Led by a16z
1894,,19-Mar-21,0.1,The LAO Unveils Institutional Neptune DAO to Foster DeFi Liquidity,The LAO Unveils Institutional Neptune DAO to Foster DeFi Liquidity
1895,,19-Mar-21,-0.2,"Market Roundup: Bitcoin Volatility Sees Mixed Results As $60,000 Fails","Market Roundup: Bitcoin Volatility Sees Mixed Results As $60,000 Fails"
1896,,18-Mar-21,0.1,"Gold, Stocks, and Bitcoin: Weekly Overview — March 18","Gold, Stocks, and Bitcoin: Weekly Overview — March 18"
1897,,18-Mar-21,0.1,Bybit Launches Cardano Perpetual Contracts With Up To 25x Leverage,Bybit Launches Cardano Perpetual Contracts With Up To 25x Leverage
1898,,18-Mar-21,0.5,Indian Crypto Exchange Expects Volumes to Double,Indian Crypto Exchange Expects Volumes to Double
1899,,18-Mar-21,-0.4,Bank of Thailand Abolishes the Use of THT Stablecoin,Bank of Thailand Abolishes the Use of THT Stablecoin
1900,,18-Mar-21,0.1,SXP Attempts To Break Out For The Third Time,SXP Attempts To Break Out For The Third Time
1901,"ENJ, XMR & EOS: Technical Analysis For March 18",18-Mar-21,0.0,,
1902,"U.S. Government Partial Bitcoin Bid Overshoots Market by $9,000",18-Mar-21,0.1,,
1903,Basic Attention Token (BAT) — Milestones and Achievements,18-Mar-21,0.1,,
1904,"VanEck Bitcoin ETF Application Acknowledged by SEC, Kicking Off Countdown",18-Mar-21,0.1,,
1905,"Bitcoin (BTC) Bounces from Support Levels, Revives Bullish Trend",18-Mar-21,0.5,,
1906,"Crypto Exchanges Could Be Seeing 100,000 New Users Per Day",18-Mar-21,0.3,,
1907,Ireland Pushing Crypto Entities to Comply with AML Laws,18-Mar-21,-0.1,,
1908,bZx DeFi Protocol the Latest to Launch on Binance Smart Chain,18-Mar-21,0.1,,
1909,Cream Finance Critical of GoDaddy in DeFi DNS Attack,18-Mar-21,-0.7,,
1910,"Market Roundup: The Luck Of The Irish Sees BTC Holding $58,000 As Filecoin Jumps 32%",17-Mar-21,0.2,,
1911,Toilet Paper Brand Charmin Enters NFT Mania With Own Collection,17-Mar-21,0.0,,
1912,Crypto.com Continue Sporting Sponsorships As Deal with NHL Team Announced,17-Mar-21,0.3,,
1913,NFT Tax Looms For Crypto-Art Holders This Tax Season,17-Mar-21,-0.2,,
1914,Twitter Hacker & Bitcoin Scammer to Serve Three Years in Prison,17-Mar-21,-0.8,,
1915,Grayscale Announces 5 New Investment Trusts,17-Mar-21,0.1,,
1916,Viral ‘Fleetwood Mac’ TikTok video to be sold as NFT,17-Mar-21,0.0,,
1917,Coinbase Files Amended S-1 Form for Public Offering,17-Mar-21,0.1,,
1918,Easing of Cryptocurrency Regulations Requested by Hawaii House Representatives,17-Mar-21,0.3,,
1919,Queen George Concert NFT to Debut on April 17,17-Mar-21,0.0,,
1920,Bank of Japan Preparing to Experiment with CBDC,17-Mar-21,0.1,,
1921,"BTC, ETH, XRP, ADA, EOS, XTZ, AVAX: Technical Analysis for March 17, 2021",17-Mar-21,0.0,,
1922,Ex-BitMEX CEO Arthur Hayes Agrees to Surrender on $10 Million Bond,17-Mar-21,-0.5,,
1923,Brave Browser’s Basic Attention Token (BAT) Reaches New Heights,17-Mar-21,0.6,,
1924,"Cardano Scores Coinbase Pro Listing, ADA Moves 22%",17-Mar-21,0.7,,
1925,Ja Rule Selling NFT Painting from Fyre Festival Debacle,17-Mar-21,-0.1,,
1926,Litecoin Completes MimbleWimble Code for LTC Scaling and Privacy,17-Mar-21,0.3,,
1927,Iron Finance DeFi Exploit Explained in Post Mortem,17-Mar-21,-0.8,,
1928,Gemini Crypto Exchange Surpasses $20 Billion in Custody,16-Mar-21,0.4,,
1929,Market Roundup: Bitcoin Stalls as eToro Goes Public Amid NFT Mania,16-Mar-21,-0.2,,
1930,Gas Flaring Powers Bitcoin Mining For Wesco,16-Mar-21,-0.1,,
1931,Nvidia Admits Ethereum Mining Limitations Lifted Accidentally,16-Mar-21,-0.3,,
1932,BIC’s Crypto Video News Show: Why is Bitcoin Dumping?,16-Mar-21,-0.4,,
1933,‘NFT’ Google Searches Overtakes ‘Cryptocurrency’ and ‘Blockchain’,16-Mar-21,0.3,,
1934,Aave Launches AMM Market,16-Mar-21,0.1,,
1935,eToro’s Alliance with Fintech Acquisition Corp V To Birth $10 Billion Firm,16-Mar-21,0.4,,
1936,"ZIL, DOGE & COCOS: Technical Analysis For March 16",16-Mar-21,0.0,,
1937,BitMEX Co-Founder Released on $20 Million Bond,16-Mar-21,0.1,,
1938,"Gnosis Announces Off-Chain Voting through SafeSnap, Yearn and Sushiswap Set to Adopt Feature",16-Mar-21,0.1,,
1939,Polish City Integrates Municipal Ethereum-Based Ecosystem — BIC Takes a Closer Look,16-Mar-21,0.1,,
1940,Cardano Blockchain to Host Digital Healthcare Platform,16-Mar-21,0.1,,
1941,"Signal Accepts Cryptocurrency Donations, App Goes Dark in China",16-Mar-21,-0.2,,
1942,Bitcoin Dominance (BTCD) Hobbles Just Above Support,16-Mar-21,-0.1,,
1943,Nifty Gateway Accounts Hacked in NFT Art Heist,16-Mar-21,-0.8,,
1944,Ripple Asks SEC to Produce Documents Related to Bitcoin and Ethereum,16-Mar-21,-0.1,,
1945,Bitcoin (BTC) Bounces Back After Sharp Drop,16-Mar-21,0.4,,
1946,Elon Musk’s ‘Song About NFTs’ Attracts $1.1 Million Bid,16-Mar-21,0.2,,
1947,"Alameda, Reef Finance Clarify Positions Following Investment Fiasco",16-Mar-21,-0.3,,
1948,Aztec Network Launches Layer 2 Privacy on Ethereum,16-Mar-21,0.1,,
1949,$40 Billion Ready To Pile Into Bitcoin as Stimulus Rolls In,15-Mar-21,0.5,,
1950,Market Roundup: Bloody Monday Sees Bitcoin Drop,15-Mar-21,-0.6,,
1951,"ATOM, UMA & LRC: Technical Analysis For March 15",15-Mar-21,0.0,,
1952,"Nasdaq Listed Firm, Diginex, Launches EQO Token",15-Mar-21,0.1,,
1953,Several Binance Smart Chain Projects Under DNS Attack,15-Mar-21,-0.7,,
1954,ALGO Breaks Out And Begins Ascent Towards $2,15-Mar-21,0.5,,
1955,"Diginex Projects Bitcoin Will Reach $175,000 by Year-End",15-Mar-21,0.6,,
1956,Over $2.24 Billion Liquidated as Crypto Markets Tank,15-Mar-21,-0.8,,
